Question_Number,Question_Text,Question_Images,Option_A,Option_A_Images,Option_B,Option_B_Images,Option_C,Option_C_Images,Option_D,Option_D_Images,Correct_Answer,Question_Type,Explanation,Explanation_Images
1,"In the working-set strategy, which of the following is done by the operating system to prevent thrashing? It initiates another process if there are enough extra frames. It selects a process to suspend if the sum of the sizes of the working-sets exceeds the total number of available frames.",,I only,,II only,,Neither I nor II,,Both I and II,,D,MCQ,"According to concept of thrashing, I is true because to prevent thrashing we must provide processes with as many frames as they really need ""right now"".If there are enough extra frames, another process can be initiated. II is true because The total demand, D, is the sum of the sizes of the working sets for all processes. If D exceeds the total number of available frames, then at least one process is thrashing, because there are not enough frames available to satisfy its minimum working set. If D is significantly less than the currently available frames, then additional processes can be launched.",
2,A problem in NP is NP-complete if,,It can be reduced to the 3-SAT problem in polynomial time,,The 3-SAT problem can be reduced to it in polynomial time,,It can be reduced to any other problem in NP in polynomial time,,Some problem in NP can be reduced to it in polynomial time,,B,MCQ,"A problem in NP becomes NPC if all NP problems can be reduced to it in polynomial time. This is the same as reducing any of the NPC problems to it. 3-SAT being an NPC problem, reducing it to an NP problem would mean that NP problem is NPC.",
3,"The characters a to h have the set of frequencies based on the first 8 Fibonacci numbers as follows a : 1, b : 1, c : 2, d : 3, e : 5, f : 8, g : 13, h : 21/ A Huffman code is used to represent the characters. What is the sequence of characters corresponding to the following code? 110111100111010",,fdheg,,ecgdf,,dchfg,,fehdg,,A,MCQ,"Background Required -  Generating Prefix codes using Huffman Coding. First we apply greedy algorithm on the frequencies of the characters to generate the binary tree as shown in the Figure given below. Assigning 0 to the left edge and 1 to the right edge, prefix codes for the characters are as below. a - 1111110 b - 1111111 c - 111110 d - 11110 e - 1110 f - 110 g - 10 h - 0 Given String can be decomposed as 110 11110 0 1110 10 f        d     h    e     g",http://www.geeksforgeeks.org/wp-content/uploads/gq/2016/12/pranjal_3.png
4,"Given a boolean function f (x 1 , x 2 , ..., x n ), which of the following equations is NOT true",,"f(x 1 ​, x 2 ​, …, x n ​) = x 1 'f(x 1 ​, x 2 ​, …, x n ​) + x 1 ​f(x 1 ​, x 2 ​, …, x n ​)",,"f(x 1 , x 2 , ..., x n ) = x 2 f(x 1 , x 2 , …, x n ) + x 2 'f(x 1 , x 2 , …, x n )",,"f(x 1 , x 2 , ..., x n ) = x n 'f(x 1 , x 2 , …, 0) + x n f(x 1 , x 2 , …,1)",,"f(x 1 , x 2 , ..., x n ) = f(0, x 2 , …, x n ) + f(1, x 2 , ..., x n )",,D,MCQ,"Option A : f (x1, x2, …, xn) = x1’f(x1, x2, …, xn) + x1f(x1, x2, …, xn) Case 1 : taking x1=0 RHS = 1.f(x1, x2, …, xn) + 0.f(x1, x2, …, xn) RHS =f(x1, x2, …, xn). Case 2 : taking x1=1 RHS = 0.f(x1, x2, …, xn) + 1.f(x1, x2, …, xn) RHS =f(x1, x2, …, xn). In both cases RHS=LHS, so, (A) is true Option B : f (x1, x2, …, xn) = x2f(x1, x2, …, xn) + x2’f(x1, x2, …, xn) Case 1 : taking x2=0 RHS= 0.f(x1, x2, …, xn) + 1.f(x1, x2…,xn) RHS =f(x1, x2, …, xn). Case 2 : taking x2=1 RHS = 1.f(x1, x2, …, xn) + 0.f(x1, x2, …, xn) RHS =f(x1, x2, …, xn).  In both cases RHS=LHS, so, (B) is true. Option C : f (x1, x2, …, xn) = xn’f(x1, x2, …, 0) + xnf(x1, x2, …,1) Case 1 : taking xn=0 RHS= 1.f(x1, x2, …, 0) + 0.f(x1, x2, …, 1) RHS =f(x1, x2, …, 0) Case 2 : taking xn=1 RHS = 0.f(x1, x2, …, 0) + 1.f(x1, x2, …, 1) RHS =f(x1, x2, …, 1)In both cases RHS=LHS, so, (C) is true. Option D : f (x1, x2, …, xn) = f(0, x2, …, xn) + f(1, x2, .., xn) Here, no way to equate LHS and RHS so ‘NOT true’ NO term depends on value of ‘x1’.",
5,"When a coin is tossed, the probability of getting a Head is p,0<p<1. Let N be the random variable denoting the number of tosses till the first Head appears, including the toss where the Head appears. Assuming that successive tosses are independent, the expected value of N is",,1/p,,1/(1−p),,1/p2,,1/(1−p2),,A,MCQ,"For a continuous variable X ranging over all the real numbers, the expectation is defined by E(X)= ∫ xf(x) dx probability for head = p probability for tail = 1-p if in first time, head appears, probability will be 1*p if firstly tail occurs,and then head occurs, then the probability will be (1-p)*p and so on.... for the nth time, probability will be (1-p) n-1 * p E= 1*p + 2*(1−p)*p + 3*(1−p)*(1−p)*p + ................... equation(1) multiply both side with (1−p): E*(1-p) = 1*p*(1-p) + 2*(1-p)*(1-p)*p + 3*(1-p)*(1-p)*(1-p)*p +............. equation (2) Subtract equation 2 from equation 1: E−E*(1−p)= 1*p+ (1−p)*p+ (1−p)*(1−p)*p +... E*p =p[1+ (1-p) + (1-p)*(1-p) + ......] It's a infinite geometric progression. E = 1/(1-(1-p)) = 1/p E=1/p correct answer is A.",
6,Which of the following DMA transfer modes and interrupt handling mechanisms will enable the highest I/O band-width?,,Transparent DMA and Polling interrupts,,Cycle-stealing and Vectored interrupts,,Block transfer and Vectored interrupts,,Block transfer and Polling interrupts,,C,MCQ,"Among the options provided, the DMA transfer mode and interrupt handling mechanism that enable the highest I/O bandwidth is option (C): Block transfer and Vectored interrupts. Let's understand why this choice provides the highest I/O bandwidth: Transparent DMA: Transparent DMA is not the most efficient option for achieving high I/O bandwidth. It allows the DMA controller to directly access the memory and transfer data without CPU involvement. However, it doesn't utilize interrupts effectively for signaling completion or handling data transfer events. Cycle-stealing: Cycle-stealing DMA interrupts the CPU during its normal operation to transfer data. While it can improve I/O bandwidth, it interrupts the CPU frequently, affecting its performance. Block transfer: Block transfer DMA involves transferring a block of data in a single operation. It minimizes the number of interrupts needed for transferring large amounts of data, resulting in efficient data transfer. Polling interrupts: Polling interrupts require the CPU to check the status of the DMA controller repeatedly to determine if data transfer has completed. This approach involves continuous CPU involvement and wastes CPU cycles, making it less efficient for achieving high I/O bandwidth. Vectored interrupts: Vectored interrupts allow the DMA controller to directly inform the CPU about data transfer events, reducing the CPU overhead. The CPU can efficiently handle the interrupts and resume its normal operations. Considering the characteristics described above, option (C) combines block transfer DMA, which minimizes interrupts for large data transfers, with vectored interrupts, which efficiently notify the CPU about data transfer events. This combination maximizes the I/O bandwidth by reducing CPU involvement and efficiently utilizing interrupts, making it the best choice among the provided options for achieving the highest I/O bandwidth.",
7,Which of the following relational query languages have the same expressive power? Relational algebra Tuple relational calculus restricted to safe expressions Domain relational calculus restricted to safe expressions,,II and III only,,I and II only,,I and III only,,"I, II and III",,D,MCQ,Relational algebra is a procedural query language where we input - relations and it yields relations as output. It provides method to get the result. It is performed recursively on a relation and the in between results are relations(output). Basic set of operations for the relational model. Relational calculus is a non - procedural query language. It provides the query to get result. Higher level declarative language for specifying relational queries. Tuple Relational Calculus operates on each tuple. Domain Relational Calculus operates on each column or attribute. Safe expression means fixed no. of tuple or column or attribute as a result But all of them has same expressive power. Just different ways to do so.,
8,"Consider the relations r 1 (P, Q, R) and r 2 (R, S, T) with primary keys P and R respectively. The relation r 1 contains 2000 tuples and r 2 contains 2500 tuples. The maximum size of the join r 1 ⋈ r 2 is :",,2000,,2500,,4500,,5000,,A,MCQ,"r 1 ⋈ r 2 is a join operation done on the common attribute R. Further R is the primary key of R2 When we take a , the value of common attribute( R2 in this case) should match.The value of  R in r2 is matched with corresponding R in r1 . So it will have 2000 tuples. So correct option is (A).",
9,"For the set N of natural numbers and a binary operation f : N x N → N, an element z ∊ N is called an identity for f, if f (a, z) = a = f(z, a), for all a ∊ N. Which of the following binary operations have an identity? f (x, y) = x + y - 3 f (x, y) = max(x, y) f (x, y) = x y",,I and II only,,II and III only,,I and III only,,None of these,,A,MCQ,"I f(x,y) = x+y-3 = x= y+x-3  =>  y=3 Here identity elements is 3 II f(x,y) = max(x,y)=x=max(y,x)  => y=1 Here identity elements is 1 (III f(x,y) =x^y is not same as f(y,x) = y^x. So no identity element.",
10,"What is the cardinality of the set of integers X defined below?  X = {n | 1 ≤ n ≤ 123, n is not divisible by either 2, 3 or 5}",,28,,33,,37,,44,,B,MCQ,"To find the cardinality of the set X={n∣1≤n≤123,n is not divisible by either 2, 3, or 5}X = \{ n \mid 1 \leq n \leq 123, n \text{ is not divisible by either 2, 3, or 5} \}X={n∣1≤n≤123,n is not divisible by either 2, 3, or 5}, we can use the principle of inclusion-exclusion. We will count the total number of integers from 1 to 123 and subtract those divisible by 2, 3, or 5. Step 1: Total number of integers from 1 to 123 The total number of integers is 123. Step 2: Count integers divisible by 2, 3, or 5 Divisible by 2: The number of integers divisible by 2 is ⌊123/2⌋ = 61. Divisible by 3: The number of integers divisible by 3 is ⌊123/3⌋ = 41. Divisible by 5: The number of integers divisible by 5 is ⌊123/5⌋ = 24. Step 3: Apply inclusion-exclusion Divisible by 2 and 3 (LCM = 6): ⌊123/6⌋ = 20 Divisible by 2 and 5 (LCM = 10): ⌊123/10⌋ = 12 Divisible by 3 and 5 (LCM = 15): ⌊123/15⌋ = 8​ Divisible by 2, 3, and 5 (LCM = 30): ⌊123/30⌋ = 4 Using the inclusion-exclusion principle: Count of integers divisible by 2, 3, or 5 = 61 + 41 + 24 − 20 − 12 − 8 + 4 = 90 Total number that are not divisible = (Total Number) - N(A U B U C) = 123 - 90 = 33",
11,"Let P, Q and R be sets let Δ denote the symmetric difference operator defined as PΔQ = (P U Q) - (P ∩ Q). Using Venn diagrams, determine which of the following is/are TRUE? PΔ (Q ∩ R) = (P Δ Q) ∩ (P Δ R) P ∩ (Q ∩ R) =  (P ∩ Q) Δ (P Δ R)",,1 only,,2 only,,Neither 1 nor 2,,Both 1 and 2,,C,MCQ,Venn Diagram 1 Venn Diagram 2 Venn Diagram 3 Venn Diagram 4 From above Venn diagrams answer C,"https://media.geeksforgeeks.org/wp-content/uploads/20250421162714819346/GATE-IT-2006-Q23-1-300.jpg, https://media.geeksforgeeks.org/wp-content/uploads/20250421162901014844/GATE-IT-2006-Q23-1-300.jpg, https://media.geeksforgeeks.org/wp-content/uploads/20250421163028567415/GATE-IT-2006-Q23-2-300.jpg, https://media.geeksforgeeks.org/wp-content/uploads/20250421163130927174/GATE-IT-2006-Q23-3-300.jpg"
12,"Consider the following first order logic formula in which R is a binary relation symbol. ∀x∀y (R(x, y)  => R(y, x)) The formula is",,satisfiable and valid,,satisfiable and so is its negation,,unsatisfiable but its negation is valid,,satisfiable but its negation is unsatisfiable,,B,MCQ,"VxVy R(x,y) => R(y,x) The above given relation is symmetry But, we have both symmetric relations possible and also possibility of anti symmetric relation. But neither of always holds for all possibilities of sets. => Both are satisfiable but not valid",
13,"The addition of 4-bit, two's complement, binary numbers 1101 and 0100 results in",,0001 and an overflow,,1001 and no overflow,,0001 and no overflow,,1001 and an overflow,,C,MCQ,"Its  -3+4=1, so no overflow  So Answer is C.",
14,"In the automaton below, s is the start state and t is the only final state. Consider the strings u = abbaba, v = bab, and w = aabb. Which of the following statements is true?",http://www.geeksforgeeks.org/wp-content/uploads/gq/2016/03/download1.png,The automaton accepts u and v but not w,,"The automaton accepts each of u, v, and w",,"The automaton rejects each of u, v, and w",,The automaton accepts u but rejects v and w,,D,MCQ,For the acceptance and rejection of any string we can simply check for the movement on each input alphabet between states. A string is accepted if we stop at any final state of the DFA. For string u=abbaba the string ends at t (final state) hence it is accepted by the DFA. For string v=bab the string ends at s (non-final state) and hence rejected by the DFA. For string w=aabb the string ends at s (non-final state) and hence rejected by the DFA.,
15,"In the context-free grammar below, S is the start symbol, a and b are terminals, and ϵ denotes the empty string  S → aSa | bSb | a | b | ϵ  Which of the following strings is NOT generated by the grammar?",,aaaa,,baba,,abba,,babaaabab,,B,MCQ,"The given Language is  Palindrome. A,C and D follow the language but baba is not a palindrome  , so B is the answer",
16,Which regular expression best describes the language accepted by the non-deterministic automaton below?,http://www.geeksforgeeks.org/wp-content/uploads/gq/2016/03/download-7.png,(a + b)* a(a + b)b,,(abb)*,,(a + b)* a(a + b)* b(a + b)*,,(a + b)*,,A,MCQ,,
17,"Consider the pushdown automaton (PDA) below which runs over the input alphabet (a, b, c). It has the stack alphabet {Z 0 , X} where Z 0 is the bottom-of-stack marker. The set of states of the PDA is (s, t, u, f} where s is the start state and f is the final state. The PDA accepts by final state. The transitions of the PDA given below are depicted in a standard manner. For example, the transition (s, b, X) → (t, XZ 0 ) means that if the PDA is in state s and the symbol on the top of the stack is X, then it can read b from the input and move to state t after popping the top of stack and pushing the symbols Z 0 and X (in that order) on the stack. (s, a, Z 0 )    →     (s, XXZ 0 ) (s, ϵ, Z 0 )    →     (f, ϵ) (s, a, X)     →     (s, XXX) (s, b, X)     →     (t, ϵ) (t, b, X)     →     (t,.ϵ) (t, c, X)      →     (u, ϵ) (u, c, X)     →     (u, ϵ) (u, ϵ, Z 0 )    →     (f, ϵ) The language accepted by the PDA is",,{a l b m c n |  l = m = n},,{a l b m c n |  l = m},,{a l b m c n |  2l = m+n},,{a l b m c n |  m=n},,C,MCQ,"Every input 'a' inserts two X into the stack and each X can be consumed by 'b' or 'c' only. On input 'a' there is no rule which gives ϵ. Thus for each 'a', termination is performed by 'b' or 'c' or both.  Example: Input: a 3 b 2 c 4 Stack:Z 0 After three a's: Stack: XXXXXXZ 0 After two b's: Stack: XXXXZ 0 After four c's: You can reach the final state. a 3 b 2 c 4 is also accepted here.",
18,"When multiplicand Y is multiplied by multiplier X = xn - 1xn-2 ....x0 using bit-pair recoding in Booth's algorithm, partial products are generated according to the following table. The partial products for rows 5 and 8 are",https://www.geeksforgeeks.org/wp-content/uploads/gq/2016/05/2006_38.jpg,2Y and Y,,-2Y and 2Y,,-2Y and 0,,0 and Y,,C,MCQ,"ALU cannot directly multiply numbers, it can only add, subtract or shift. Booth’s algorithm is a means by which we can perform multiplication with the help of addition, subtraction and shift. For performing multiplication, write both the signed numbers in binary and make the no. of bits in both equal by padding 0. Here, partial product is calculated by bit pair recoding in booth’s algorithm. (-2 x(i+1)+x(i)+x(i-1))Y So, option (C) is correct.",
19,"A computer system has a level-1 instruction cache (1-cache), a level-1 data cache (D-cache) and a level-2 cache (L2-cache) with the following specifications: The length of the physical address of a word in the main memory is 30 bits. The capacity of the tag memory in the I-cache, D-cache and L2-cache is, respectively,",http://www.geeksforgeeks.org/wp-content/uploads/gq/2016/05/2006_43-300x150.jpg,"1 K x 18-bit, 1 K x 19-bit, 4 K x 16-bit",,"1 K x 16-bit, 1 K x 19-bit, 4 K x 18-bit",,"1 K x 16-bit, 512 x 18-bit, 1 K x 16-bit",,"1 K x 18-bit, 512 x 18-bit, 1 K x 18-bit",,A,MCQ,Number of blocks in cache = Capacity / Block size = 2 m Bits to represent blocks = m Number of words in a block =  2 n words Bits to represent a word = n tag bits = (length of the physical address of a word) – (Bits to represent blocks ) – (Bits to represent a word) Each block will have it's own tag bits. So total tag bits = number of blocks x tag bits.,
20,A cache line is 64 bytes. The main memory has latency 32ns and bandwidth 1G.Bytes/s. The time required to fetch the entire cache line from the main memory is,,32 ns,,64 ns,,96 ns,,128 ns,,C,MCQ,"for 1 GBps bandwidth => it takes 1 sec to load 109 bytes on line so, for 64 bytes it will take 64 * 1 /109 =  64 ns main memory latency given is 32 so, total time required to place cache line is 64+32 = 96 ns",
21,Which of the following statements about relative addressing mode is FALSE?,,It enables reduced instruction size,,It allows indexing of array elements with same instruction,,It enables easy relocation of data,,It enables faster address calculations than absolute addressing,,D,MCQ,"Explanation: As relative address are calculated from absolute address, So relative addressing cannot be faster than absolute addressing. relative address =  absolute address + offset relative address find using the absolute address, so the address calculation is slower for relative address than absolute address",
22,Which of the following statements is TRUE?,,Both Ethernet frame and IP packet include checksum fields,,Ethernet frame includes a checksum field and IP packet includes a CRC field,,Ethernet frame includes a CRC field and IP packet includes a checksum field,,Both Ethernet frame and IP packet include CRC fields,,C,MCQ,"ETHERNET FRAME FORMAT: 1. It also called IEEE 802.3 protocol. 2. Used at data link layer, bus topology, CSMA/CD access control, NO acknowledgement used. 3. For securing CRC is used, more precisely, CRC-32 bit. IP DATAGRAM FORMAT: IP datagram uses 16-bit checksum. So, ETHERNET->CRC and IP->checksum.","https://cdncontribute.geeksforgeeks.org/wp-content/uploads/gatecs_19.png, https://cdncontribute.geeksforgeeks.org/wp-content/uploads/gatecs0_19.png"
23,Which feature of OOP indicates code reusability?,,Abstraction,,Polymorphism,,Encapsulation,,Inheritance,,D,MCQ,Inheritance indicates the code reusability. Encapsulation and abstraction are meant to hide/group data into one element. Polymorphism is to indicate different tasks performed by a single entity.,
24,"The following function computes the value of m C n correctly for all legal values m and n (m≥1,n≥0 and m>n) C int func ( int m , int n ) { if ( E ) return 1 ; else return ( func ( m -1 , n ) + func ( m - 1 , n - 1 )); } In the above function, which of the following is the correct expression for E?",,(n = = 0) || (m = = 1),,(n = = 0) && (m = = 1),,(n = = 0) || (m = = n),,(n = = 0) && (m = = n),,C,MCQ,Make a recursion tree of the given function recursion.,
25,"Which one of the choices given below would be printed when the following program is executed? C #include void swap ( int * x , int * y ) { static int * temp ; temp = x ; x = y ; y = temp ; } void printab () { static int i , a = -3 , b = -6 ; i = 0 ; while ( i <= 4 ) { if (( i ++ ) % 2 == 1 ) continue ; a = a + i ; b = b + i ; } swap ( & a , & b ); printf ( ""a =  %d, b = %d \\ n"" , a , b ); } main () { printab (); printab (); }",,"a = 0, b = 3 a = 0, b = 3",,"a = 3, b = 0 a = 12, b = 9",,"a = 3, b = 6 a = 3, b = 6",,"a = 6, b = 3 a = 15, b = 12",,D,MCQ,"Things to ponder: • swap function doesn’t actually swaps two variables, rather just swaps their addresses in local variables x and y - which is effectively nothing once swap function returns. • printab function adds 9 to static variables a and b. The number 9 comes from the fact that the while loop executes those arithmetic statements only when i = 1, 3, 5. Hence, when printab is called for the first time, these are the local variable values: a = −3 + 9 and b = −6 + 9. On the second time, a = −3 + 9 + 9 and b = −6 + 9 + 9 are the desired values. Therefore, correct answer would be (D) a = 6, b = 3; a = 15, b = 12.",
26,"A link of capacity 100 Mbps is carrying traffic from a number of sources. Each source generates an on-off traffic stream; when the source is on, the rate of traffic is 10 Mbps, and when the source is off, the rate of traffic is zero. The duty cycle, which is the ratio of on-time to off-time, is 1 : 2. When there is no buffer at the link, the minimum number of sources that can be multiplexed on the link so that link capacity is not wasted and no data loss occurs is S 1 . Assuming that all sources are synchronized and that the link is provided with a large buffer, the maximum number of sources that can be multiplexed so that no data loss occurs is S 2 . The values of S 1 and S 2 are, respectively,",,10 and 30,,12 and 25,,5 and 33,,15 and 22,,A,MCQ,"10 Mbps * n <= 100 Mbps   {n= number of stations} n = 10 if n is very large: a station transmits with probability 1/(1+2 = 1/3, with a capacity of 10Mbps so, for n stations: (1/3)*10+(1/3)*10+(1/3)*10+ ……… + n times <= 100 Mbps (1/3)*10[1+1+1+1+…….+ n times] <= 100 (1/3)*10*n<=100 n=30",
27,"On a wireless link, the probability of packet error is 0.2. A stop-and-wait protocol is used to transfer data across the link. The channel condition is assumed to be independent from transmission to transmission. What is the average number of transmission attempts required to transfer 100 packets?",,100,,125,,150,,200,,B,MCQ,Probability of success = 0.8 E = 0.8 * 1 + 0.8 * 1 +... n times = 100   {for 100 packets} => 0.8 * 1 * n = 100 => n = 125 to receive 100 packets we have to transmit 125 packets,
28,"Consider the following XML DTD describing course information in a university: XML <!ELEMENT Univ (Course+, Prof+)> <!ELEMENT Course (Title, Eval*)> <!ATTLIST Course Number ID #REQUIRED Instructor IDREF #IMPLIED> <!ELEMENT Title (#PCDATA)> <!ELEMENT Eval (#PCDATA)> <!ATTLIST Eval Score CDATA #REQUIRED> <!ELEMENT Prof EMPTY> <!ATTLIST Prof Name ID #REQUIRED Teaches IDREF #IMPLIED> What is returned by the following XQuery? let $as := / /@Score for $c in /Univ/Course[Eval] let $cs := $c/Eval?@Score where min($cs) > avg($as) return $c",,The professor with the lowest course evaluation,,Professors who have all their course evaluations above the university average,,The course with the lowest evaluation,,Courses with all evaluations above the university average,,C,MCQ,Out of syllabus now,
29,A router has two full-duplex Ethernet interfaces each operating at 100 Mb/s. Ethernet frames are at least 84 bytes long (including the Preamble and the Inter-Packet-Gap). The maximum packet processing time at the router for wirespeed forwarding to be possible is (in micro­seconds),,0.01,,3.36,,6.72,,8,,B,MCQ,"Here, we need to maintain the speed of wire, it means the receiving and sending rates both are the maximum possible,i.e., maximum throughput. So, processing time should be at most same as minimum transmission time to maintain the wire speed. As if router will process it in the minimum transmission time even if a packet is transmitted in minimum time it gets processed and the packet doesn’t get delayed for transmission.   Since router has two full-duplex Ethernet interfaces each operating at 100 Mb/s. Therefore, maximum packet processing time at the router, = minimum transmission time = (84 bytes) / (2*100 bits per sec) = (84 * 8 bits) / (2*100 bits per sec) = 3.36 seconds So, option (B) is correct.",
30,"In the 4B/5B encoding scheme, every 4 bits of data are encoded in a 5-bit codeword. It is required that the codewords have at most 1 leading and at most 1 trailing zero. How many such codewords are possible?",,14,,16,,18,,20,,C,MCQ,The possible codewords should not have 00xxx or xxx00 => Total possible combinations of 5 bits – for (00xxx or xxx00)+ (00x00) {as 00x00 is subtracted twice once each from both cases} => 32 – (8+8) +2 = 18,
31,"Suppose that it takes 1 unit of time to transmit a packet (of fixed size) on a communication link. The link layer uses a window flow control protocol with a window size of N packets. Each packet causes an ack or a nak to be generated by the receiver, and ack/nak transmission times are negligible. Further, the round trip time on the link is equal to N units. Consider time i > N. If only acks have been received till time i(no naks), then the goodput evaluated at the transmitter at time i(in packets per unit time) is",,1 - N/i,,i/(N + i),,1,,1 - e (i/N),,A,MCQ,"successfully delivered packets = (i-N) {transmission time of a packet =1 unit, so in i time i packets can be transmitted. And RTT = N, so only N packets are ACKed} So, for time i, i-N packets are transmitted Goodput = Successfully delivered data/ Time = (i-N)/i = 1- N/i",
