Question_Number,Question_Text,Question_Images,Option_A,Option_A_Images,Option_B,Option_B_Images,Option_C,Option_C_Images,Option_D,Option_D_Images,Correct_Answer,Question_Type,Explanation,Explanation_Images
32,A router uses the following routing table: A packet bearing a destination address 144.16.68.117 arrives at the router. On which interface will it be forwarded?,http://www.geeksforgeeks.org/wp-content/uploads/gq/2016/05/2006_63-300x104.png,eth0,,eth1,,eth2,,eth3,,C,MCQ,"For sure A and B can not be answer For C: subnet address of interface = 144. 16 . 68 .0 Subnet address of incoming IP = 144.  16.  68. 117  AND 255.255.255.0   = 144.  16.  68.0 Both subnetwork addresses are same, so can be forwarded to this interface eth2 D: Subnet address of incoming IP = 144.  16.  68. 117  AND 255.255.255.224   = 144.  16.  68.96 Hence both subnet addresses are different, so cannot be forwarded to this eth3 interface.",
33,"An array X of n distinct integers is interpreted as a complete binary tree. The index of the first element of the array is 0. The index of the parent of element X[i],i≠0 is?",,lowerbound[i/2],,upperbound[(i-1)/2],,upperbound[i/2],,upperbound[i/2] -1,,D,MCQ,left child of ith element will be at 2*i+1 and right child at 2(i+1),
34,"In a database file structure, the search key field is 9 bytes long, the block size is 512 bytes, a record pointer is 7 bytes and a block pointer is 6 bytes. The largest possible order of a non-leaf node in a B+ tree implementing this file structure is",,23,,24,,34,,44,,C,MCQ,"For B+ tree with order n, index pointer p, and block size = B For a non leaf node it can be given that n*p + (n-1)*(k) <= B n*6 + (n-1)*9 <= 512 n <= 34.77",
35,"Consider a relation R with five attributes V, W, X, Y, and Z. The following functional dependencies hold: VY→ W, WX → Z, and ZY → V. Which of the following is a candidate key for R?",,VXZ,,VXY,,VWXY,,VWXYZ,,B,MCQ,"Using VY, W can be explored. With WX, Z can be explored",
36,"Consider the following structure chart diagram. The boxes have function names embedded in them, while the variables are indicated along the arcs. Given below are a set of statements relevant to the above diagram. I.   F3 and F6 can be in the same module. II.  F4 and F6 can be in the same module. III. A4 is both an output and a control variable. IV.  It is incorrect to pass A1 as data and use it as a control variable. Which combination of these statements is TRUE?",http://www.geeksforgeeks.org/wp-content/uploads/gq/2016/05/2006_59-300x147.png,III and IV,,I and IV,,II and IV,,"I, II and IV",,B,MCQ,Out of syllabus now,
37,"A software program consists of two modules M 1 and M 2 that can fail independently, but never simultaneously. The program is considered to have failed if any of these modules fails. Both the modules are 'repairable' and so the program starts working again as soon as the repair is done. Assume that the mean time to failure (MTTF) of M 1 is T 1 with a mean time to repair (MTTR) of R 1 . The MTTF of M 2 is T 2 with an MTTR of R 2 . What is the availability of the overall program given that the failure and repair times are all exponentially distributed random variables?",,((T 1 T 2 )/(T 1 R 1 + T 2 R 2 )),,((R 1 R 2 )/(T 1 R 1 + T 2 R 2 )),,((T 1 T 2 )/(T 1 T 2 + T 1 R 1 + T 2 R 2 )),,((T 1 T 2 )/(T 1 T 2 + T 1 R 2 + T 2 R 1 )),,B,MCQ,,
38,"A pipelined processor uses a 4-stage instruction pipeline with the following stages: Instruction fetch (IF), Instruction decode (ID), Execute (EX) and Writeback (WB). The arithmetic operations as well as the load and store operations are carried out in the EX stage. The sequence of instructions corresponding to the statement X = (S - R * (P + Q))/T is given below. The values of variables P, Q, R, S and T are available in the registers R 0 , R 1 , R 2 , R 3 and R 4 respectively, before the execution of the instruction sequence. The number of Read-After-Write (RAW) dependencies, Write-After-Read( WAR) dependencies, and Write-After-Write (WAW) dependencies in the sequence of instructions are, respectively,",http://www.geeksforgeeks.org/wp-content/uploads/gq/2016/05/2006_78-300x172.jpg,"2, 2, 4",,"3, 2, 3",,"4 ,2, 2",,"3 ,3, 2",,C,MCQ,Read After Write : 1. ADD -> MUL (R5) 2. MUL -> SUB (R6) 3. SUB -> DIV (R5) 4. DIV -> STORE (R6) Write After Read : 1. MUL -> SUB (R5) 2. DIV -> STORE (R6) Write After Write : 1. ADD -> SUB (R5) 2. MUL – DIV (R6),
39,The process state transition diagram of an operating system is as given below. Which of the following must be FALSE about the above operating system?,http://www.geeksforgeeks.org/wp-content/uploads/gq/2016/03/download-3.png,It is a multiprogrammed operating system,,It uses preemptive scheduling,,It uses non-preemptive scheduling,,It is a multi-user operating system,,B,MCQ,"A - It is Correct - In a multiprogramming environment,  multiple processes can be in ready state B - It is Incorrect because once in running state there is no provision to go back to ready state C - It is Correct because once in running state there is no provision to go back to ready state D- It is Correct In a multi User environment,  multiple processes can be in ready state",
40,"Consider a database with three relation instances shown below. The primary keys for the Drivers and Cars relation are did and cid respectively and the records are stored in ascending order of these primary keys as given in the tables. No indexing is available in the database. Let n be the number of comparisons performed when the above SQL query is optimally executed. If linear search is used to locate a tuple in a relation using primary key, then n lies in the range","http://www.geeksforgeeks.org/wp-content/uploads/gq/2016/05/2006_84_85-300x297.jpg, http://www.geeksforgeeks.org/wp-content/uploads/gq/2016/05/2006_84_85_2-300x290.jpg, http://www.geeksforgeeks.org/wp-content/uploads/gq/2016/05/2006_84_85_3-300x152.jpg",36 - 40,,44 - 48,,60 - 64,,100 - 104,,B,MCQ,"here we have to calculate the number of comparisons performed when the above SQL query is optimally executed. from the first inner query: select R.did from Cars C, Reserves R where R.cid = C.cid and C.colour = 'red' C.color = ""Red"", comparisons=4 (Cars has four rows) R.cid=C.cid so there are five rows extracted to this where condition. comparisons=(2 red cars * 10 Reserves rows)=20 from the second inner query: select R.did from Cars C, Reserves R where R.cid = C.cid and C.colour = 'green' C.color = ""Green"", comparisons=4 (Cars has four rows) R.cid=C.cid so there are three rows extracted to this where condition. comparisons=(1 green car*10 Reserves rows)=10 R.did = {22, 22, 31,31, 64} for first inner query R.did = {22, 31, 74} for second inner query Here unique sets are, R.did={22,31,64} and R.did={22,31,74} respectively for first and second inner queries. so for intersection, 6 comparisons (for 22, we hit on the first try and for 31,we hit on the second try,and for 74,we hit on all three try, so comaprisons=1+2+3) Finally we have to locate the did - 22 and did 31 from the driver table and did is the primary key. As told in the question, we use linear search and for 22, we hit on the first try and for 31 we hit on the third try. So, 1 + 3 = 4 comparisons. so total no of comparisons= 4+20+4+10+6+4=48 therefore B is the answer. In short: So, first get 2 red cars by scanning 4 tuples of the cars relation. Now, for each of the two 'red' cars, we scan all the 10 tuples of the 'Reserves' relation and thus we get 2*10 + 4 = 24 comparisons.Similarly for the 'green' car we get 4+10 = 14 comparisons.",
41,Consider a database with three relation instances shown below. The primary keys for the Drivers and Cars relation are did and cid respectively and the records are stored in ascending order of these primary keys as given in the tables. No indexing is available in the database. What is the output of the following SQL query?,"http://www.geeksforgeeks.org/wp-content/uploads/gq/2016/05/2006_84_85-300x297.jpg, http://www.geeksforgeeks.org/wp-content/uploads/gq/2016/05/2006_84_85_2-300x290.jpg, http://www.geeksforgeeks.org/wp-content/uploads/gq/2016/05/2006_84_85_3-300x152.jpg, http://www.geeksforgeeks.org/wp-content/uploads/gq/2016/05/2006_84_85_4-300x88.jpg","Karthikeyan, Boris",,"Sachin, Salman",,"Karthikeyan, Boris, Sachin",,"Schumacher, Senna",,A,MCQ,"The sub-query always executes before the execution of the main query. Subqueries are completed first.The result of the subquery is used as input for the outer query. from the first inner query: select R.did from Cars C, Reserves R where R.cid = C.cid and C.colour = 'red'. C.color = ""Red"", corresponding C.cid={102,104}. R.cid=C.cid so there are five rows extracted to this where condition. R.did = {22, 22, 31,31, 64} from the second inner query: select R.did from Cars C, Reserves R where R.cid = C.cid and C.colour = 'green' C.color = ""Green"", corresponding C.cid={103} R.cid=C.cid so there are three rows extracted to this where condition. R.did = {22, 31, 74} Finally, the outer query selects driver names whose did = {22,31} which corresponds to Karthikeyan and Boris. so the correct option is A.",
42,"A software project has four phases P1, P2, P3 and P4. Of these phases, P1 Is the first one and needs to be completed before any other phase can commence. Phases P2 and P3 can be executed in parallel. Phase P4 cannot commence until both P2 and P3 are completed. The optimistic, most likely, and pessimistic estimates of the phase completion times in days, for Pl, P2, P3 and P4 are, respectively, (11, 15, 25), (7, 8, 15), (8, 9, 22), and (3, 8, 19). The costs (in Rupees per day) of crashing the expected phase completion times for the four phases, respectively, are 100, 2000, 50, and 1000. Assume that the expected phase completion times of the phases cannot be crashed below their respective most likely completion times. The minimum and the maximum amounts (in Rupees) that can be spent on crashing so that ALL paths are critical are, respectively.",,100 and 1000,,100 and 1200,,150 and 1200,,200 and 2000,,D,MCQ,Critical task is the one on longest path intermediate task:P3,
43,"A software project has four phases P1, P2, P3 and P4. Of these phases, P1 Is the first one and needs to be completed before any other phase can commence. Phases P2 and P3 can be executed in parallel. Phase P4 cannot commence until both P2 and P3 are completed. The optimistic, most likely, and pessimistic estimates of the phase completion times in days, for Pl, P2, P3 and P4 are, respectively, (11, 15, 25), (7, 8, 15), (8, 9, 22), and (3, 8, 19). The critical path for the above project and the slack of P2 are, respectively,",,"P1-P2-P4, 1 day",,"P1-P3-P4, 1 day",,"P1-P3-P4, 2 days",,"P1-P2-P4, 2 days",,C,MCQ,,
44,Let L be a regular language. Consider the constructions on L below: repeat (L) = {ww | w ∊ L} prefix (L) = {u | ∃v : uv ∊ L} suffix (L) = {v | ∃u uv ∊ L} half (L) = {u | ∃v : | v | = | u | and uv ∊ L} Which choice of L is best suited to support your answer above?,,(a + b)*,,"{ϵ, a, ab, bab}",,(ab)*,,{a n b n | n ≥ 0},,A,MCQ,"A counter example which proves all the conclusions of the last question in one go should have the following properties 1) L should be regular due to the demand of the question 2) L should be an infinite set of strings, otherwise half(L) would be regular 3) L should have more than one alphabets in its grammar, otherwise repeat(L) would be regular. i. (a + b) ∗ is perfect example to support the conclusions of last question. It is regular, has more than one alphabets and is an infinite set. ii. {#, a, ab, bab} is a finite set, hence wrong. iii. (ab) ∗ is equivalent to c ∗ , which is one alphabet language, hence wrong. iv. {a n b n |n ≥ 0} is not even a regular language, hence wrong.",
45,Let L be a regular language. Consider the constructions on L below: repeat (L) = {ww | w ∊ L} prefix (L) = {u | ∃v : uv ∊ L} suffix (L) = {v | ∃u uv ∊ L} half (L) = {u | ∃v : | v | = | u | and uv ∊ L} Which of the constructions could lead to a non-regular language?,,Both I and IV,,Only I,,Only IV,,Both II and III,,B,MCQ,"repeat(L) should not be confused with concatenation as there is a specific order to it. Only same strings are concatenated with each other and not all. Moreover, double word language is not even a CFG [non-regular]. prefix(L) is a regular language - all the states in L’s DFA could be made final, giving result to a DFA which would accept prefix(L) [regular]. suffix(L) is a regular language as a NFA could be constructed which would accept suffix(L). Every state in L’s DFA can get an incident # ? edge from start state - this NFA would accept suffix(L) [regular] half(L) is a regular language. It is just a language containing even length strings. So, option (B) is true.",
46,"A pipelined processor uses a 4-stage instruction pipeline with the following stages: Instruction fetch (IF), Instruction decode (ID), Execute (EX) and Writeback (WB). The arithmetic operations as well as the load and store operations are carried out in the EX stage. The sequence of instructions corresponding to the statement X = (S - R * (P + Q))/T is given below. The values of variables P, Q, R, S and T are available in the registers R 0 , R 1 , R 2 , R 3 and R 4 respectively, before the execution of the instruction sequence. The IF, ID and WB stages take 1 clock cycle each. The EX stage takes 1 clock cycle each for the ADD, SUB and STORE operations, and 3 clock cycles each for MUL and DIV operations. Operand forwarding from the EX stage to the ID stage is used. The number of clock cycles required to complete the sequence of instructions is",http://www.geeksforgeeks.org/wp-content/uploads/gq/2016/05/2006_78-300x172.jpg,10,,12,,14,,16,,B,MCQ,"Pipelining is a technique in which the instructions are performed in parallel by executing different phases of the instructions. Generally, if two operations are performed in which second operation has dependent operands on first then, the second should not fetch operands until the first one executes as it will otherwise fetch incorrect operands. Hence, stalls are created . Now to overcome this , operand forwarding technique was introduced in which there is an interface through which the operand results are transferred. So, even if the incorrect operands were fetch during the fetch operations during the execution phase the incorrect operands are replaced by the correct operands. Thus,in the given question,though MUL is dependent on ADD due to R5,SUB is dependent on MUL due to R6 DIV is dependent on SUB and STORE dependent on DIV still we can perform Instruction fetch and decode operations in the pipelined processor. Where, IF-instruction fetch ID-instruction decode EX-execute WB-write back As shown in the table 12 clock cycles will be taken to perform the given instructions.",https://cdncontribute.geeksforgeeks.org/wp-content/uploads/gateit_79.png
47,"A program on machine X attempts to open a UDP connection to port 5376 on a machine Y, and a TCP connection to port 8632 on machine Z. However, there are no applications listening at the corresponding ports on Y and Z. An ICMP Port Unreachable error will be generated by",,Y but not Z,,Z but not Y,,Neither Y nor Z,,Both Y and Z,,D,MCQ,"A Destination Unreachable message may be generated as a result of a TCP, UDP or another ICMP transmission. Reference: https://en.wikipedia.org/wiki/Internet_Control_Message_Protocol",
48,x + y/2 = 9 3x + y = 10 What can be said about the Gauss-Siedel iterative method for solving the above set of linear equations?,,it will converge,,It will diverse,,It will neither converge nor diverse,,It is not applicable,,A,MCQ,,"http://www.geeksforgeeks.org/wp-content/uploads/gq/2016/12/anil_8.png, http://www.geeksforgeeks.org/wp-content/uploads/gq/2016/12/anil_8_1.png, http://www.geeksforgeeks.org/wp-content/uploads/gq/2016/12/anil_8_3.png"
49,x + y/2 = 9 3x + y = 10 The value of the Frobenius norm for the above system of equations is:,,0.5,,0.75,,1.5,,2.0,,D,MCQ,,http://www.geeksforgeeks.org/wp-content/uploads/gq/2016/12/anil_7.png
50,"C void swap ( float * A1 , float * A2 ) { float temp ; if ( * A1 = = * A2 ) return ; temp = * A1 ; * A1 = * A2 ; * A2 = temp ; return ; } The program effort for the above module using Halstead's method is",,315,,330,,393,,403,,C,MCQ,Out of syllabus,
51,"C void swap ( float * A1 , float * A2 ) { float temp ; if ( * A1 = = * A2 ) return ; temp = * A1 ; * A1 = * A2 ; * A2 = temp ; return ; } The program volume for the above module using Halstead's method is",,60,,63,,66,,69,,B,MCQ,,
52,"An array X of n distinct integers is interpreted as a complete binary tree. The index of the first element of the array is 0. If the root node is at level 0, the level of element X[i], i ≠ 0, is",,⌊log 2 i⌋,,⌈log 2 (i + 1)⌉,,⌊log 2 (i + 1)⌋,,⌈log 2 i⌉,,C,MCQ,,
53,"An array X of n distinct integers is interpreted as a complete binary tree. The index of the first element of the array is 0. If only the root node does not satisfy the heap property, the algorithm to convert the complete binary tree into a heap has the best asymptotic time complexity of",,O (n),,O (log n),,O (nlog n),,O (n log log n),,B,MCQ,It takes O(logn) to heapify an element of heap,
54,"In a certain town, the probability that it will rain in the afternoon is known to be 0.6. Moreover, meteorological data indicates that if the temperature at noon is less than or equal to 25°C, the probability that it will rain in the afternoon is 0.4. The temperature at noon is equally likely to be above 25°C, or at/below 25°C. What is the probability that it will rain in the afternoon on a day when the temperature at noon is above 25°C?",,0.4,,0.6,,0.8,,0.9,,C,MCQ,,
55,A subnetted Class B network has the following broadcast address : 144.16.95.255. Its subnet mask,,is necessarily 255.255.224.0,,is necessarily 255.255.240.0,,is necessarily 255.255.248.0,,"could be any one of 255.255.224.0, 255.255.240.0, 255.255.248.0",,D,MCQ,"Class B network has first 16 bits dedicated for network and last 16 for hosts. In subnetting bits are borrowed from host part.144.16.95.255 In broadcast address the host bits are all made 1’s and the sub-network ID bits are kept as it is. So ,144.16.95.255 10010000.00010000.01011111.11111111 Clearly, last 13 bits are 1 So, according to broadcast address definition last 13 bits can be host bits Now ,as the sub-network ID bits are kept as it is so these 13 bits can also be representing subnet. So,last 13 bits are representing subnet ID bits + host bits Subnet mask is represented by putting 1’s in place of all bits representing subnet ID and 0’s in place of all bits representing hosts. a) 255.255.224.0 11111111.11111111.11100000.00000000 As last 13 bits can be host bits ,so this can be subnet mask but not necessarily as we have seen already that from last 13 bits can be subnet ID bits+ host bits. So,not option a. b) 255.255.240.0 11111111.11111111.11110000.00000000 As last 12 bits can be host bits ,so this can be subnet mask but not necessarily as we have seen already that last 13 bits can be host bits + subnet bits. So,not option b. c) 255.255.248.0 11111111.11111111.11111000.00000000 As last 11 bits can be host bits ,so this can be subnet mask but not necessarily as we have seen already that last 13 bits can be host bits + subnet bits. So,not option c. d) As shown in the above explanation 255.255.224.0, 255.255.240.0, 255.255.248.0 anyone can be subnet mask Another Explanation: For broadcast address of a subnet, all the host bits are set to 1. broadcast address for subnet is .95.255 => .0101 1111. 1111 1111 So possible host bits can be 13 to 0",
56,"Consider the solution to the bounded buffer producer/consumer problem by using general semaphores S, F, and E. The semaphore S is the mutual exclusion semaphore initialized to 1. The semaphore F corresponds to the number of free slots in the buffer and is initialized to N. The semaphore E corresponds to the number of elements in the buffer and is initialized to 0. Which of the following interchange operations may result in a deadlock? Interchanging Wait (F) and Wait (S) in the Producer process Interchanging Signal (S) and Signal (F) in the Consumer process",,I Only,,II Only,,Neither I nor II,,Both I and II,,A,MCQ,"Suppose F = 0. Now, if Wait(F) and Wait(S) are interchanged and Wait(S) in producer succeeds, the producer will wait for Wait(F) which is signalled in Consumer, which is never going to succeed as it is waiting for Wait(S) to be signal by producer. So, deadlock can happen.",
57,"With respect to software testing, consider a flow graph G with one connected component. Let E be the number of edges, N be the number of nodes, and P be the number of predicate nodes of G. Consider the following four expressions: E - N + P E - N + 2 P +  2 P + 1 The cyclomatic complexity of G is given by",,I or III,,II or III,,II or IV,,I or IV,,C,MCQ,,
58,"Consider the undirected graph G defined as follows. The vertices of G are bit strings of length n. We have an edge between vertex u and vertex v if and only if u and v differ in exactly one bit position (in other words, v can be obtained from u by flipping a single bit). The ratio of the chromatic number of G to the diameter of G is",,1/(2 n-a ),,1/n,,2/n,,3/n,,C,MCQ,"Bipartite graph:- A bipartite graph is a graph G(V,E) where vertices can be decomposed into two disjoint sets such that no two vertices within the same set are adjacent. Diameter of a graph:- The longest shortest path in between any two vertices of a graph The given graph is a bipartite graph => chromatic number is equals to 2 The diameter of graph is equals to n because at most we need to traverse n-1 edges.  The ratio = 2/n  Reference: https://en.wikipedia.org/wiki/Hypercube_graph",
59,"What are the eigenvalues of the matrix P given below [Tex] \begin{pmatrix} 
 a     & 1     & 0 \\ 
  1     & a     & 1 \\ 
  0     & 1     &a
\end{pmatrix} [/Tex]",,"a, a -√2, a + 	√2",,"a, a, a",,"0, a, 2a",,"-a, 2a, 2a",,A,MCQ,det(A-λ.I))=0 (a-λ)*[(a-λ) 2 -1] -1*(a-λ)= 0 (a-λ) 3 - 2(a-λ) = 0 (a-λ)((a-λ) 2 - 2) = 0 (a-λ)(a-λ+√2)(a-λ-√2) = 0,
60,Match the following iterative methods for solving algebraic equations and their orders of convergence.,http://www.geeksforgeeks.org/wp-content/uploads/gq/2016/05/2006_27-300x131.jpg,"I-R, II-S, III-P, IV-Q",,"I-S, II-R, III-Q, IV-P",,"I-S, II-Q, III-R, IV-P",,"I-S, II-P, III-Q, IV-R",,D,MCQ,,http://www.geeksforgeeks.org/wp-content/uploads/gq/2016/12/anil_5.png
61,The following definite integral evaluates to,http://www.geeksforgeeks.org/wp-content/uploads/gq/2016/05/2006_28.jpg,1/2,,√10,,None,,,,C,MCQ,,http://www.geeksforgeeks.org/wp-content/uploads/gq/2016/12/anil_6.png
62,Consider the regular grammar below S → bS | aA | ϵ A → aS | bA The Myhill-Nerode equivalence classes for the language generated by the grammar are,,{w ∊ (a + b)* | #a(w) is even) and {w ∊ (a + b)* | #a(w) is odd},,{w ∊ (a + b)* | #a(w) is even) and {w ∊ (a + b)* | #b(w) is odd},,{w ∊ (a + b)* | #a(w) = #b(w) and {w ∊ (a + b)* | #a(w) ≠ #b(w)},,"{ϵ}, {wa | w ∊ (a + b)* and {wb | w ∊ (a + b)*}",,A,MCQ,,http://www.geeksforgeeks.org/wp-content/uploads/gq/2016/05/2006_29-300x180.jpg
63,Which of the following statements about regular languages is NOT true?,,Every language has a regular superset,,Every language has a regular subset,,Every subset of a regular language is regular,,Every subset of a finite language is regular,,C,MCQ,Regular Languages are not closed under subset. Reference: https://courses.engr.illinois.edu/cs373/sp2009/handouts/closure/regular-closure.html,
64,Which of the following languages is accepted by a non-deterministic pushdown automaton (PDA) but NOT by a deterministic PDA?,,{a n b n c n ∣ n≥0},,{a l b m c n ∣ l≠m or m≠n},,{a n b n ∣ n≥0},,"{a m b n ∣ m,n≥0}",,B,MCQ,"1. L = {a n b n c n |n >= 0} this is not a CFL, as there is no PDA that can derive this language. Same can be proved using pumping lemma, as can be seen intuitively as well. [INCORRECT] 2. L = {a l b m c n |l! = m or m! = n} is union of two CFLs L1 = {a l b m c n |l! = m} and L2 = {a l b m c n |m! = n} both having DPDA. Hence L is sure a CFL, thus it will have a DFA, though not necessarily a deterministic one. L = {a n b n c n } and DPDA are closed under complementation - thus if L is a DPDA then its complement should be a DPDA as well, which is not true. Hence, L is accepted by a NPDA. [CORRECT] 3. L = {a n b n |n ≥ 0} can be derived from a deterministic PDA - push if current alphabet is a and pop if it is b. Accept if stack is empty on the end of the string and reject otherwise. [INCORRECT] 4. L = {a n b m |n, m ≥ 0} is a regular language of the form a ∗ b ∗ , hence it has a DPDA. [INCORRECT]",
65,Let L be a context-free language and M a regular language. Then the language L ∩ M is,,always regular,,never regular,,always a deterministic context-free language,,always a context-free language,,D,MCQ,"L is a context free language and M is a regular language, hence context free as well. Therefore, L ∩ M is context free for sure, according to closure laws of context free languages. We need to check whether it would be regular or non-regular always. We can prove that by giving examples s.t. L ∩ M can be regular and non-regular both. • L = {a n b n |n ≥ 0} and M = a * b*, in this case L ∩ M will be L itself, hence context free but not regular. L ∩ M won’t be deterministic CFL everytime either, like in this example. • L = {a n b n |n ≥ 0} and M = a, in this case L ∩ M will be M itself, hence regular. Considering the above statement, correct answer would be (D) always a context-free language.",
