Question_Number,Question_Text,Question_Images,Option_A,Option_A_Images,Option_B,Option_B_Images,Option_C,Option_C_Images,Option_D,Option_D_Images,Correct_Answer,Question_Type,Explanation,Explanation_Images
66,"In the context-free grammar below, S is the start symbol, a and b are terminals, and ϵ denotes the empty string. S → aSAb | ϵ A → bA | ϵ The grammar generates the language",,((a + b)* b)*,,{a m b n | m ≤ n},,{a m b n | m = n},,a* b*,,B,MCQ,"from A: ((a + b)* b)* It accepts aa string but, given grammar does not. The simplest string accepted by grammar given is abb, so option C not true and option D is also false.",
67,The boolean function for a combinational circuit with four inputs is represented by the following Karnaugh map. Which of the product terms given below is an essential prime implicant of the function?,http://www.geeksforgeeks.org/wp-content/uploads/gq/2016/05/2006_35.jpg,QRS,,PQS,,PQ\'S\',,Q\'S\',,D,MCQ,Essential prime implicants are prime implicants that cover an output of the function that no combination of other prime implicants is able to cover.,
68,"The majority function is a Boolean function f(x, y, z) that takes the value 1 whenever a majority of the variables x, y, z and 1. In the circuit diagram for the majority function shown below, the logic gates for the boxes labeled P and Q are, respectively,",http://www.geeksforgeeks.org/wp-content/uploads/gq/2016/05/2006_36-300x182.jpg,"XOR, AND",,"XOR, XOR",,"OR, OR",,"OR, AND",,D,MCQ,"Truth tables of given operations are as follows: y z XOR OR AND 0 0 0 0 0 0 1 1 1 0 1 0 1 1 0 1 1 0 1 1 Thus we have OR and AND which give different outputs on (0, 0) and (1, 1). The encoder can hence select from the two and decide output of the function according to x. Reference: http://nptel.ac.in/courses/117106086/30",
69,"The memory locations 1000, 1001 and 1020 have data values 18, 1 and 16 respectively before the following program is executed.<br>  MOVI         Rs, 1                     ; Move immediate <br>  LOAD        Rd, 1000(Rs)     ; Load from memory<br>  ADDI         Rd, 1000             ; Add immediate<br>  STOREI    0(Rd), 20            ; Store immediate<br>  Which of the statements below is TRUE after the program is executed ?",,Memory location 1000 has value 20,,Memory location 1020 has value 20,,Memory location 1021 has value 20,,Memory location 1001 has value 20,,D,MCQ,Rs<-1 Rd<-1 Rd<-1001 store in address 1001 <- 20,
70,"The wait and signal operations of a monitor are implemented using semaphores as follows. In the following, x is a condition variable, mutex is a semaphore initialized to 1, x_sem is a semaphore initialized to 0, x_count is the number of processes waiting on semaphore x_sem, initially 0, next is a semaphore initialized to 0, next_count is the number of processes waiting on semaphore next, initially 0. P(mutex); body of procedure if (next_count > 0) V(next); else V(mutex); Each occurrence of x.wait is replaced with the following: x_count = x_count + 1; if (next_count > 0) V(next) else V(mutex); ---------------------------------- E1; x_count = x_count - 1; Each occurrence of x.signal is replaced with the following: if (x_count > 0) { next_count = next_count + 1; ---------------------------------- E2; P(next), next_count = next_count - 1; } For correct implementation of the monitor, statements E1 and E2 are, respectively,",,"P(x_sem), V(next)",,"V(next), P(x_sem)",,"P(next), V(x_sem)",,"P(x_sem), V(x_sem)",,D,MCQ,"We have a semaphore mutex (initialized to 1) for each monitor. Every process must execute P(mutex) [wait (mutex)] and V(mutex) [signal(mutex)] before entering and leaving the monitor respectively. x_count is incremented and decremented in x.wait, which means P(x_sem)(wait on x_sem) must happen. Similarly,  V(x_sem) must happen in x.signal. The above-discussed question is the implementation of the monitor using semaphore.",
71,"For each of the four processes P 1 , P 2 , P 3 and P 4 . The total size in kilobytes (KB) and the number of segments are given below. The page size is 1 KB. The size of an entry in the page table is 4 bytes. The size of an entry in the segment table is 8 bytes. The maximum size of a segment is 256 KB. The paging method for memory management uses two-level paging, and its storage overhead is P. The storage overhead for the segmentation method is S. The storage overhead for the segmentation and paging method is T. What is the relation among the overheads for the different methods of memory management in the concurrent execution of the above four processes ?",http://www.geeksforgeeks.org/wp-content/uploads/gq/2016/05/2006_56-300x129.jpg,P < S < T,,S < P < T,,S < T < P,,T < S < P,,C,MCQ,,
72,"The arrival time, priority, and duration of the CPU and I/O bursts for each of three processes P 1 , P 2 and P 3 are given in the table below. Each process has a CPU burst followed by an I/O burst followed by another CPU burst. Assume that each process has its own I/O resource. The multi-programmed operating system uses preemptive priority scheduling. What are the finish times of the processes P 1 , P 2 and P 3 ?",http://www.geeksforgeeks.org/wp-content/uploads/gq/2016/05/2006_54-300x148.jpg,"11, 15, 9",,"10, 15, 9",,"11, 16, 10",,"12, 17, 11",,B,MCQ,So finishing time of p1 p2 p3 are 10 15 9,https://media.geeksforgeeks.org/wp-content/uploads/20200921183155/UntitledDiagram.jpg
73,"Which one of the choices given below would be printed when the following program is executed? C #include int a1 [] = { 6 , 7 , 8 , 18 , 34 , 67 }; int a2 [] = { 23 , 56 , 28 , 29 }; int a3 [] = { -12 , 27 , -31 }; int * x [] = { a1 , a2 , a3 }; void print ( int * a []) { printf ( ""%d,"" , a [ 0 ][ 2 ]); printf ( ""%d,"" , * a [ 2 ]); printf ( ""%d,"" , *++ a [ 0 ]); printf ( ""%d,"" , * ( ++ a )[ 0 ]); printf ( ""%d \\ n"" , a [ -1 ][ + 1 ]); } main () { print ( x ); }",,"8, -12, 7, 23, 8",,"8, 8, 7, 23, 7",,"-12, -12, 27, -31, 23",,"-12, -12, 27, -31, 56",,A,MCQ,"int *x[] = {a1, a2, a3}; line makes x[0] = a1 and likewise. Therefore whenever x[0] is referenced, internally a1 array is being looked upon. a[0][2] = a1[2] = 8 *a[2] = *a3 = a3[0] = -12 *++a[0] = *(++a[0]) = a1[1] = 7 : a[0] is now pointing to second element of a1. *(++a)[0] = *a2 = a2[0] = 23 : a is now pointing to array a2. a[-1][+1] = *(a1+1+1) = a1[2] = 8 : *(a-1) = a1+1 due to last two expressions. Hence, correct answer would be (A) 8, -12, 7, 23, 8.",
74,"Which one of the choices given below would be printed when the following program is executed ? C #include <stdio.h> struct test { int i ; char * c ; } st [] = { 5 , ""become"" , 4 , ""better"" , 6 , ""jungle"" , 8 , ""ancestor"" , 7 , ""brother"" }; main () { struct test * p = st ; p += 1 ; ++ p -> c ; printf ( ""%s,"" , p ++ -> c ); printf ( ""%c,"" , *++ p -> c ); printf ( ""%d,"" , p [ 0 ]. i ); printf ( ""%s \\ n"" , p -> c ); }",,"jungle, n, 8, nclastor",,"etter, u, 6, ungle",,"cetter, k, 6, jungle",,"etter, u, 8, ncestor",,B,MCQ,"Basic Requirement – Knowledge of Structures struct test *p = st; st is a array of structures in which the integer is the “i” variable of structure and the character array is the “c” variable of structure.  p is a pointer of structure test type which is pointing to the array of structures (first element). p contains the base address of first structure in st array i.e { 5, become}. p += 1; This statement increments p by one which means p now point to the next structure (because p is pointer of type structure test, so on incrementing it by one it will jump one structure). p now points to {4, better}.  Before moving on to further statements we first discuss about the operators and their precedence .    “->” is structure operator which gets the member of the structure being referred. It has higher priority than increment/decrement (++, --) and dereferencing operation (*).  Now a brief discussion about post increment and pre increment operator.  Pre-increment operator is used to increment the value of variable before using in the expression. In the Pre-Increment value is first incremented and then used inside the expression.  Post-increment operator is used to increment the value of variable as soon as after executing expression completely in which post increment is used. In the Post-Increment value is first used in a expression and then incremented. ++p -> c; In this statement the structure operator (higher priority) will first make p point to the c variable inside the structure. Now pointer is inside the character array, now incrementing the pointer in character array ‘c’ will jump one character in character array. Hence the character array now starts from “e”. p->c moves pointer inside the structure to the variable “c”. printf(""%s,"", p++ -> c); In this statement there is post increment operator used. First the statement will be executed and then operator will work. Currently p is pointing to second structure { 4, better} and inside structure the character array is starting from e because of the previous statement so p->c will print the string “etter” and after that the post increment operator will increment the structure and p now will point to next structure. printf(""%c,"", *++p -> c); In this statement p->c points to “jungle” (p was currently pointing to 3rd structure {6, jungle}) and then the pre incrementing operator just like in previous pre increment statement moves one character and now the pointer points to “u”, dereferencing operator here prints the value at the address where the pointer is pointing and since the pointer is pointing at “u” so u is printed. printf(""%d,"", p[0].i); In this statement p[0] will give the address where p is currently pointing i.e {6, jungle} and the structure operator (.) will point to the “i” variable of the structure printing 6 as a result. printf(""%s \\n"", p -> c); This statements prints the character string of the structure to which p is currently pointing and since because of earlier increment of character array, character array starts from “u” therefore “ungle” is printed.",
75,"Consider the depth-first-search of an undirected graph with 3 vertices P, Q, and R. Let discovery time d(u) represent the time instant when the vertex u is first visited, and finish time f(u) represent the time instant when the vertex u is last visited. Given that d(P) = 5 units	 f(P) = 12 units d(Q) = 6 units	 f(Q) = 10 units d(R) = 14 unit	 f(R) = 18 units which one of the following statements is TRUE about the graph",,There is only one connected component,,"There are two connected components, and P and R are connected",,"There are two connected components, and Q and R are connected",,"There are two connected components, and P and Q are connected",,D,MCQ,since d(q)=d(p)+1 and f(q)< f(p) which means p and q are connected and r is separate so d is the answer,
76,Which of the following is the correct decomposition of the directed graph given below into its strongly connected components?,http://www.geeksforgeeks.org/wp-content/uploads/gq/2016/05/2006_46-300x206.png,"{P, Q, R, S}, {T}, {U}, {V}",,"{P,Q, R, S, T, V}, {U}",,"{P, Q, S, T, V}, {R}, {U}",,"{P, Q, R, S, T, U, V}",,B,MCQ,Reference: http://www.geeksforgeeks.org/strongly-connected-components/,
77,"The data path shown in the figure computes the number of 1s in the 32-bit input word corresponding to an unsigned even integer stored in the shift register. The unsigned counter, initially zero, is incremented if the most significant bit of the shift register is The micro-program for the control is shown in the table below with missing control words for micro-instructions I 1 , I 2 , ..... I n . The counter width (k), the number of missing micro-instructions (n), and the control word for microinstructions I 2 , ..... I n are, respectively,","http://www.geeksforgeeks.org/wp-content/uploads/gq/2016/05/2006_41-300x178.jpg, http://www.geeksforgeeks.org/wp-content/uploads/gq/2016/05/2006_41_2-300x138.jpg","32, 5, 010",,"5, 32, 010",,"5, 31, 011",,"5, 31, 010",,D,MCQ,For a number to be even LSB bit has to be 0.<br>  So there may be only 31 1’s for an unsigned EVEN integer.<br>  And 31 left shifts are needed to determine number of 1's.,
78,For a state machine with the following state diagram the expression for the next state S+ in terms of the current state S and the input variables x and y is,http://www.geeksforgeeks.org/wp-content/uploads/gq/2016/05/2006_37-300x153.jpg,S + = S\' . y\' + S . x,,S + =S. x . y\' + S\' . y . x\',,S + =x . y\',,S + =S\' . y + S . x\',,A,MCQ,"For the next state to be S=1 there are two possible cases: S=1, x=1 S=0, y=0 For the next state to be S=0 there are two possible cases: S=1, x=0 S=0, y=1 The above conditions can be tabulated as (where X means that variable has no effect on state transition) x y S S+ 1 X 1 1 X 0 0 1 0 X 1 0 X 1 0 0 It is clearly visible that S+ depends on state S and either of the variable x or y. This directly eliminates option (B) and option (C). Now we can check for the other two options. When S=1 and x=1 option (D) gives S+ as 0 which should otherwise be one hence (D) can also be eliminated. Option (A) satisfies all, hence the answer.",
79,"In a binary tree, the number of internal nodes of degree 1 is 5, and the number of internal nodes of degree 2 is 10. The number of leaf nodes in the binary tree is",,10,,11,,12,,15,,B,MCQ,"In a binary tree, the number of leaf nodes is always 1 more than number of internal nodes with 2 children, refer http://www.geeksforgeeks.org/handshaking-lemma-and-interesting-tree-properties/ So, Number of Leaf Nodes = Number of Internal nodes with 2 children + 1 Number of Leaf Nodes = 10 + 1 Number of Leaf Nodes = 11",
80,Suppose that we have numbers between 1 and 100 in a binary search tree and want to search for the number 55. Which of the following sequences CANNOT be the sequence of nodes examined?,,"{10, 75, 64, 43, 60, 57, 55}",,"{90, 12, 68, 34, 62, 45, 55}",,"{9, 85, 47, 68, 43, 57, 55}",,"{79, 14, 72, 56, 16, 53, 55}",,C,MCQ,"In BST, on right child of parent should be greater than parent and left child should be smaller than the parent, but in C after 47, 68 goes on the right side because it greater then parent, now everything below this point should be greater then 47 but 43 appears that does not satisfy the BST property.",https://media.geeksforgeeks.org/wp-content/cdn-uploads/20201116142856/1227.png
81,Which of the following statement(s) is TRUE? A hash function takes a message of arbitrary length and generates a fixed length code. A hash function takes a message of fixed length and generates a code of variable length. A hash function may give the same hash value for distinct messages.,,I only,,II and III only,,I and III only,,II only,,C,MCQ,"Hash function is defined as any function that can be used to map data of arbitrary size of data to a fixed size data.. The values returned by a hash function are called hash values, hash codes, digests, or simply hashes  :  Statement 1 is correct Yes, it is possible that a Hash Function maps a value to a same location in the memory that's why collision occurs and we have different technique to handle  this problem : Statement 3 is correct. eg : we have hash function, h(x) = x mod 3 Acc to Statement 1, no matter what the value of 'x' is h(x) results in a fixed mapping location. Acc. to Statement 3, h(x) can result in same mapping mapping location for different value of 'x' e.g. if x = 4 or x = 7 , h(x) = 1 in both the cases, although collision occurs.",
82,The cyclomatic complexity of the flow graph of a program provides,,an upper bound for the number of tests that must be conducted to ensure that all statements have been executed at most once,,a lower bound for the number of tests that must be conducted to ensure that all statements have been executed at most once,,an upper bound for the number of tests that must be conducted to ensure that all statements have been executed at least once,,a lower bound for the number of tests that must be conducted to ensure that all statements have been executed at least once,,C,MCQ,"Option (C) is correct, because the cyclomatic complexity of the flow graph of a program provides an upper bound for the number of tests that must be conducted to ensure that all statements have been executed at least once.",
83,Which of the following sequences of array elements forms a heap?,,"{23, 17, 14, 6, 13, 10, 1, 12, 7, 5}",,"{23, 17, 14, 6, 13, 10, 1, 5, 7, 12}",,"{23, 17, 14, 7, 13, 10, 1, 5, 6, 12}",,"{23, 17, 14, 7, 13, 10, 1, 12, 5, 7}",,C,MCQ,"When they are asking for heap, by default it's max heap. Basic Requirement: Array representation of binary tree Starting from basics lets first understand heap trees We have 2 types of heap – Min heap and Max heap. In Min heap the parent is always smaller than its children and in Max heap parent is always greater than its children. Looking at the options we can tell that which tree is Max heap tree. Now consider each option one by one and draw a tree  From options it is clear that only option C satisfies the Max heap tree property. Hence Option(C) is the correct answer.",
84,"If all the edge weights of an undirected graph are positive, then any subset of edges that connects all the vertices and has minimum total weight is a",,Hamiltonian cycle,,grid,,hypercube,,tree,,D,MCQ,"As here we want subset of edges that connects all the vertices and has minimum total weight i.e. Minimum Spanning Tree Option A - includes cycle, so may or may not connect all edges. Option B - has no relevance to this question. Option C - includes cycle, so may or may not connect all edges. Related: http://www.geeksforgeeks.org/greedy-algorithms-set-2-kruskals-minimum-spanning-tree-mst/ http://www.geeksforgeeks.org/greedy-algorithms-set-5-prims-minimum-spanning-tree-mst-2/",
85,"HELO and PORT, respectively, are commands from the protocols",,FTP and HTTP,,TELNET and POP3,,HTTP and TELNET,,SMTP and FTP,,D,MCQ,"Simple Mail Transfer Protocol (SMTP) : It is an Internet standard used for transmitting email. Electronic mail servers and other mail transfer agents use SMTP to send and receive mail messages. The client sends 'HELO' command to the SMTP server to identify itself and initiate the SMTP conversation. File Transfer Protocol (FTP) : It is a network protocol used to transfer computer files between a client and server on a computer network. FTP communications use two port number values -- one for commands (port 21 by default), and one for data transfer. This is where the PORT command comes into play. The PORT command is sent by an FTP client to establish a secondary connection (address and port) for data to travel over.",
