Question_Number,Question_Text,Question_Images,Option_A,Option_A_Images,Option_B,Option_B_Images,Option_C,Option_C_Images,Option_D,Option_D_Images,Correct_Answer,Question_Type,Explanation,Explanation_Images,subject,chapter,subtopic
73,"In the simplified flowchart given below, the shaded boxes represent code that is executed during a test case. The Branch coverage is",https://rkokdq5fgqqf84hb.public.blob.vercel-storage.com/gate-cs/2007/Question_Images/5f872128adad52a9-D9CWsYF9jhW4342jmSK0S2AcBFOffp.png,3/4,,2/3,,1/2,,3/8,,D,MCQ,3/8 are exposed,https://rkokdq5fgqqf84hb.public.blob.vercel-storage.com/gate-cs/2007/Explanation_Images/8a0ee165f6770887-t5A6Z7teDAqgGbml0PiYVHlMKTIJ58.jpg,,,
74,"Consider the CPM activity chart where an arc connecting two milestones is labeled with a task identifier and the time taken in days. For example in order to go from A to B, task T1 takes 180 days. A dashed line depicts an additional dependency that is equivalent to a zero time task. The set of activities that lie on the critical path are",https://rkokdq5fgqqf84hb.public.blob.vercel-storage.com/gate-cs/2007/Question_Images/9401a4aeac66869c-O6RR2iY52en4MINO4cZ6nQwdOS3RSe.png,"T1, T2, T8, T10",,"T1, T3, T8, T10",,"T1, T2, T3, T4, T5, T6, T7, T8, T9, T10",,"T1, T4, T5, T7, T8, T10",,D,MCQ,"Critical path is the one which takes longest time,",,,,
75,"Suppose you are given an implementation of a queue of integers Consider the following function: C++ void f ( queue < int > & Q ) { int i ; if ( ! Q . empty ()) { i = Q . front (); Q . pop (); f ( Q ); Q . push ( i ); } } C void f ( queue Q ) { int i ; if ( ! isEmpty ( Q )) { i = delete ( Q ); f ( Q ); insert ( Q , i ); } } Java void f ( Queue < Integer > Q ) { if ( ! Q . isEmpty ()) { int i = Q . poll (); f ( Q ); Q . add ( i ); } } Python def f ( Q ): if Q : i = Q . pop ( 0 ) f ( Q ) Q . append ( i ) JavaScript function f ( Q ) { if ( Q . length > 0 ) { let i = Q . shift (); f ( Q ); Q . push ( i ); } } What operation is performed by the above function f ?",,Leaves the queue Q unchanged,,Reverses the order of the elements in the queue Q,,Deletes the element at the front of the queue Q and inserts it at the rear keeping the other elements in the same order,,Empties the queue Q,,B,MCQ,"As it is recursive call, and removing from front while inserting from end, that means last element will be deleted at last and will be inserted 1 st in the new queue. And like that it will continue till first call executes insert(Q,i) function. So, the queue will be in reverse. Hence Option (B) is the correct answer.",,Programming and Data Structures,Linear Data Structures,"Arrays, stacks, queues, linked lists"
76,Consider a hash function that distributes keys uniformly. The hash table size is 20. After hashing of how many keys will the probability that any new key hashed collides with an existing one exceed 0.5.,,5,,6,,7,,10,,D,MCQ,"For each entry probability of collision is 1/20 {as possible total spaces =20, and an entry will go into only 1 place} Say after inserting x values probability becomes 1/2 => (1/20).x = 1/2 => X=10 Hence Option(D) is the correct answer.",,Algorithms,Basic Techniques,"Searching, sorting, hashing"
77,"When searching for the key value 60 in a binary search tree, nodes containing the key values 10, 20, 40, 50, 70 80, 90 are traversed, not necessarily in the order given. How many different orders are possible in which these key values can occur on the search path from the root to the node containing the value 60?",,35,,64,,128,,5040,,A,MCQ,"There are two set of values, smaller than 60 and greater than 60. Smaller values 10, 20, 40 and 50 are visited, means they are visited in order. Similarly, 90, 80 and 70 are visited in order. = 7!/(4!3!) = 35",,Programming and Data Structures,Non-Linear Data Structures,"Trees, binary search trees, binary heaps, graphs"
78,What is the largest integer m such that every simple connected graph with n vertices and n edges contains at least m different spanning trees?,,1,,2,,3,,n,,C,MCQ,"A graph is connected iff all nodes can be traversed from each node. For a graph with n nodes, there will be n-1 minimum number of edges. Given that there are n edges, that means a cycle is there in the graph. The simplex graph with these conditions may be: Now we can make a different spanning tree by removing one edge from the cycle, one at a time. Minimum cycle length can be 3, So, there must be atleast 3 spanning trees in any such Graph.",https://rkokdq5fgqqf84hb.public.blob.vercel-storage.com/gate-cs/2007/Explanation_Images/5f5b88367463d960-1CdA75kf6plYE2ftTiVUtQ7hub0oMd.png,Engineering Mathematics,Discrete Mathematics,Graph Theory
79,Consider the XML document fragment given below: Consider the XPath expression: *[not (self ) : : TOC] What would be the result of the given XPath expression when the current node is Book?,https://rkokdq5fgqqf84hb.public.blob.vercel-storage.com/gate-cs/2007/Question_Images/e988df3d6a14b0c6-1iTiA00qPXQg7vSgy5qFfnxXNthnzd.png,The Title and Content elements,,The Content and TOC elements,,The Title and TOC elements,,"The Title, Content and TOC elements",,D,MCQ,Out of Syllabus now,,Databases,Data Models,
80,"Consider the XML document fragment given below: With reference to the HTML lines given above, consider the following statements. 1. Clicking on the point <80, 75> does not have any effect. 2. The web browser can identify the area applicable to the mouse-click within the image and the subsequent action to be taken without additional responses from the web server. 3. The dots in the cgi-bin URL will be resolved by the web browser before it is sent to the web server 4. The ""fd.html"" request when sent to the web server will result in a GET request. Exactly how many of the statements given above are correct?",https://rkokdq5fgqqf84hb.public.blob.vercel-storage.com/gate-cs/2007/Question_Images/456a4a005e73368e-EN9oqrjCWgZlMTWtmYD2z7fbaz8To1.png,0,,1,,2,,3,,D,MCQ,,,Computer Networks,Application Layer,"DNS, HTTP, SMTP, FTP, POP"
81,"Consider the B-tree in the adjoining figure, where each node has at most two keys and three links. Keys K15 and then K25 are inserted into this tree in that order. Exactly how many of the following nodes (disregarding the links) will be present in the tree after the two insertions?",,1,,2,,3,,4,,D,MCQ,"Initially, the tree has the keys: K30, K50, K20, K15, K30 . The tree is a B-tree , which means after inserting a key that causes a node to exceed its capacity (more than two keys), a split will occur. Inserting K15: After inserting K15, the tree will need to adjust to accommodate the new key in a way that maintains the properties of the B-tree. Given that K15 is smaller than K20, it will move into the left node. The insertion of K15 does not cause a split in the root. The tree remains as it is but with K15 now in the left node. Inserting K25: Inserting K25 will require splitting nodes. The B-tree structure will adjust by splitting a node that exceeds the limit of two keys. After the second insertion (K25), the structure will be as shown, resulting in a split and forming a new root . Present Nodes after the Insertions: After both insertions, the tree will have: K30 in the new root. K50 is still part of the tree. K25 and K15 are also present. Hence, 4 nodes (K30, K50, K25, and K15) will be in the tree. Thus, the correct answer is: d) 4",,Databases,File Organization and Indexing,
82,Now the key K50 is deleted from the 8-tree resulting after the two insertions made earlier. Consider the following statements about the B-tree resulting after this deletion. (i) The height of the tree remains the same. (ii) The node (disregarding the links) is present in the tree. (iii) The root node remains unchanged (disregarding the links). Which one of the following options is true?,,Statements (i) and (ii) are true.,,Statements (ii) and (iii) are true.,,Statements (iii) and (i) are true.,,All the statements are false.,,A,MCQ,"Explanation: (i) The height of the tree remains the same: This statement could be true or false depending on the specific structure of the B-tree. Deleting a key may cause a reorganization that could affect the height of the tree. However, in most cases where a key is deleted from a non-root node, the height typically remains the same. (ii) The node (disregarding the links) is present in the tree: This could also be true. In a B-tree, nodes don't get physically removed immediately after deletion; instead, the key is removed from the node, and only the links might change. (iii) The root node remains unchanged (disregarding the links): The root node might change if the deletion causes the root node to become underpopulated, requiring the root to merge or redistribute keys. Therefore, this statement could be false in such cases. Correct Answer: The correct option is a) Statements (i) and (ii) are true because, generally, the height of the tree may remain unchanged, and the node (ignoring links) could still be in the tree after a key deletion.",,Databases,File Organization and Indexing,
