Question_Number,Question_Text,Question_Images,Option_A,Option_A_Images,Option_B,Option_B_Images,Option_C,Option_C_Images,Option_D,Option_D_Images,Correct_Answer,Question_Type,Explanation,Explanation_Images,subject,chapter,subtopic
48,"Let P 1 ,P 2 ,…,P n be n points in the xy-plane such that no three of them are collinear. For every pair of points P i and P j , let L ij be the line passing through them. Let Lab be the line with the steepest gradient among all n(n−1)/2 lines. The time complexity of the best algorithm for finding P a and P b is",,Θ(n),,Θ(nlogn),,Θ(nlogsup>2n),,Θ(n 2 ),,B,MCQ,,,Algorithms,Complexity Analysis,Asymptotic worst-case time and space complexity
49,The head of a hard disk serves requests following the shortest seek time first (SSTF) policy. The head is initially positioned at truck number 180.  Which of the request sets will cause the head to change its direction after servicing every request assuming that the head does not change direction if there is a tie in SSTF and all the requests arrive before the servicing starts?,,"11, 139, 170, 178, 181, 184, 201, 265",,"10, 138, 170, 178, 181, 185, 201, 265",,"10, 139, 169, 178, 181, 184, 201, 265",,"10, 138, 170, 178, 181, 185, 200, 265",,B,MCQ,"A. 180->181->184 B. 180->181->178->185->170->201->138->265->10 So, B is true",https://rkokdq5fgqqf84hb.public.blob.vercel-storage.com/gate-cs/2007/Explanation_Images/2c955d491216bf9a-q2JlynoXG4quIEMbFPfHaVwxu4t498.png,Operating System,Scheduling,CPU and I/O scheduling
50,"The head of a hard disk serves requests following the shortest seek time first (SSTF) policy. The head is initially positioned at track number 180.  What is the maximum cardinality of the request set, so that the head changes its direction after servicing every request if the total number of tracks are 2048 and the head can start from any track?",,9,,10,,11,,12,,C,MCQ,Distance of SSTF changing – > 1 3 7 15 31 63 127 255 511 1023 2047 1 2 3 4 5 6 7 8 9 10 11 Head is changing it's direction after servicing every request. Maximum Cardinality is thus 11 180->181->178->185->170->201->138->265->10,https://rkokdq5fgqqf84hb.public.blob.vercel-storage.com/gate-cs/2007/Explanation_Images/2c955d491216bf9a-q2JlynoXG4quIEMbFPfHaVwxu4t498.png,Operating System,Scheduling,CPU and I/O scheduling
51,Consider the following pseudo-code: C IF (( A > B ) AND ( C > D )) THEN A = A + 1 B = B + 1 ENDIF The cyclomatic complexity of the pseudo-code is,,2,,3,,4,,5,,C,MCQ,"Cyclomatic complexity = (π − s + 2) where π is the number of decision points in the program, and s is the number of exit points.",,,,
52,"Suppose there are two coins. The first coin gives heads with probability 5/8 when tossed, while the second coin gives heads with probability 1/4. One of the two coins is picked up at random with equal probability and tossed. What is the probability of obtaining heads ?",,7/8,,1/2,,7/16,,5/32,,C,MCQ,Either 1st coin is selected or second coin is selected Probability of 1st coin to be selected = ½ And probability of getting head on it = 5/8 Or Probability of 2nd coin to be selected = 1/2 And probability of getting head on 2nd coin = ¼ Probability of getting head (overall) = (Probability of selecting 1st coin * Probability of head on it) +(Probability of selecting 2nd coin * Probability of getting head on it)  = (1/2)*(5/8) + (1/2)*(1/4) = 7/16,,Engineering Mathematics,Probability and Statistics,Conditional probability and Bayes theorem
53,"Let a memory have four free blocks of sizes 4k, 8k, 20k, 2k. These blocks are allocated following the best-fit strategy. The allocation requests are stored in a queue as shown below. The time at which the request for J 7 will be completed will be",https://rkokdq5fgqqf84hb.public.blob.vercel-storage.com/gate-cs/2007/Question_Images/d8e74935ff24fb57-IKeV33opkEYbFBfalU1sf2IJ55wlhe.jpg,16,,19,,20,,37,,B,MCQ,"Initially when a process arrives and needs memory, it would search for a hole big enough to fit the job and if the hole is larger then the remaining hole is returned to the free storage list. Memory Block Size Job (t=0) Job(t=8) Job(t=10) Job(t=11) 1 4k J3 - 2 units (1K free left) 2 8k J4 – 8 units (2K free left) J5 - 14 units J5 – 14 units J5 – 14 units 3 20k J2 -10 units(6K free left) J2 -10 units J6 – 11 units J7 – 19 units 4 2k J1 -4 units Therefore, the process finishes at J7=19 units Option B",,Operating System,Memory Management,
54,"A depth-first search is performed on a directed acyclic graph. Let d[u] denote the time at which vertex u is visited for the first time and f[u] the time at which the dfs call to the vertex u terminates. Which of the following statements is always true for all edges (u, v) in the graph ?",,d[u] < d[v],,d[u] < f[v],,f[u] < f[v],,f[u] > f[v],,D,MCQ,"Starting DFS at node V, 1] Visit(V) -> DFS(X) ->Visit(X) ->DFS(U) ->Visit(U) -> backtrack(X) -> backtrack(V) Therefore: d[U] > d[V], d[U] < f[V], f[U] < f[V] . But, visiting order is just opposite of finishing order. Hence f[U] > f[V]",https://rkokdq5fgqqf84hb.public.blob.vercel-storage.com/gate-cs/2007/Explanation_Images/d9ad9bc36445787d-YpXHF9C2lXLHQakZit5K4fFkffcw8w.png,Algorithms,Graph Algorithms,"Graph traversals, minimum spanning trees, shortest paths"
55,"Consider the program below in a hypothetical programming language which allows global variables and a choice of static or dynamic scoping. C int i ; program main () { i = 10 ; call f (); } procedure f () { int i = 20 ; call g (); } procedure g () { print i ; } Let x be the value printed under static scoping and y be the value printed under dynamic scoping. Then, x and y are",,"x = 10, y = 10",,"x = 20, y = 10",,"x = 10, y = 20",,"x = 20, y = 20",,C,MCQ,"Static scoping: C int i ; program main () { i = 10 ; call f (); } procedure f () { int i = 20 ; call g (); } procedure g () { print i ; //as i=20 is scoped only within f() so it will point to global i } So , 10 is printed Dynamic scoping : int i ; program main () { i = 10 ; call f (); } procedure f () { int i = 20 ; // here global scoped i is changed call g (); } procedure g () { print i ; // global value changed so, i=20 printed }",,Compiler Design,Runtime Environments,
56,"Early binding refers to a binding performed at compile time and late binding refers to a binding performed at execution time. Consider the following statements: i.   Static scope facilitates w1 bindings. ii.  Dynamic scope requires w2 bindings. iii. Early bindings w3 execution efficiency. iv. Late bindings w4 execution efficiency. The right choices of wl, w2, w3 and w4 (in that order) are",,"Early, late, decrease, increase",,"Late, early, increase, decrease",,"Late, early, decrease, increase",,"Early, late, increase, decrease",,D,MCQ,Early binding can be done in Static Scoping(during compile time). Early binding increases efficiency (running time will be reduced). Late binding can be done in Dynamic scoping (during execution time). Late binding decreases efficiency as it needs to be done at run-time. (but it increases flexibility),,Compiler Design,Runtime Environments,
57,"The floating point unit of a processor using a design D takes 2t cycles compared to t cycles taken by the fixed point unit. There are two more design suggestions D1 and D2. D1 uses 30% more cycles for fixed point unit but 30% less cycles for floating point unit as compared to design D. D2 uses 40% less cycles for fixed point unit but 10% more cycles for floating point unit as compared to design D. For a given program which has 80% fixed point operations and 20% floating point operations, which of the following ordering reflects the relative performances of three designs? (Di > Dj denotes that Di is faster than Dj)",,D1 > D > D2,,D2 > D > D1,,D > D2 > D1,,D > D1 > D2,,A,MCQ,"0.8 * (time taken in fixed point) + 0.2 (time taken in floating point) Say, t=1 D = 0.8(1) + 0.2(2) =1.2 D1 = 0.8(1.3)+0.2(1.4) =1.04 +.28 =1.32 D2 = 0.8(1-0.04) + 0.2(2-2*0.1) = 0.8*0.96 + 0.2*1.8 = 0.768 +0.36 = 1.128 D1>D>D2",,Computer Organization and Architecture,Pipelining,"Instruction pipelining, pipeline hazards"
58,"Consider a Direct Mapped Cache with 8 cache blocks (numbered 0-7). If the memory block requests are in the following order 3, 5, 2, 8, 0, 63, 9,16, 20, 17, 25, 18, 30, 24, 2, 63, 5, 82,17, 24. Which of the following memory blocks will not be in the cache at the end of the sequence ?",,3,,18,,20,,30,,B,MCQ,"Location of memory block in cache  =  block  % number of cache blocks  Since it is a direct mapped cache, no replacement policy is required. As we can see in the table, 18 is further replaced by 82 in the 2nd cache block whereas 3,20 and 30 are all present in the cache till the end. Therefore, Answer is B Memory Block Blocks 0 8, 0, 16, 24 1 9, 17, 25, 63, 17 2 2, 18 , 2, 82 3 3 4 20 5 5, 5 6 30 7 63,63",,Computer Organization and Architecture,Memory Hierarchy,"Cache, main memory and secondary storage"
59,"The following expression was to be realized using 2-input AND and OR gates. However, during the fabrication all 2-input AND gates were mistakenly substituted by 2-input NAND gates. (a.b).c + (a'.c).d + (b.c).d + a. d What is the function finally realized ?",,1,,a' + b' + c' + d',,a' + b + c' + d',,a' + b' + c + d',,C,MCQ,,,Digital Logic,Combinational and sequential circuits,
60,"Data forwarding techniques can be used to speed up the operation in presence of data dependencies. Consider the following replacements of LHS with RHS. In which of the following options, will the result of executing the RHS be the same as executing the LHS irrespective of the instructions that follow ?",https://rkokdq5fgqqf84hb.public.blob.vercel-storage.com/gate-cs/2007/Question_Images/9a816ad1fed299a1-rbZz55w1nElcWduUdDhdBvFYn7baJv.jpg,(i) and (iii),,(i) and (iv),,(ii) and (iii),,(ii) and (iv),,B,MCQ,"(i) Is true, as both registers and location contain the value of R1 (iii) is wrong because in LHS R2 is writing last but not in RHS. (iv)True, as first write to LOC is useless, as it is overwritten by R2.  (ii) false, because R2 get the correct data, but location has not got updated.",,Computer Organization and Architecture,Pipelining,"Instruction pipelining, pipeline hazards"
61,What is the final value stored in the linear feedback shift register if the input is 101101? Circuit,https://rkokdq5fgqqf84hb.public.blob.vercel-storage.com/gate-cs/2007/Question_Images/fa8df495d752bc7b-WnDyI3ZyQCY6DqmI4sMJkgYqoTIcSM.png,0110,,1011,,1101,,1111,,A,MCQ,The linear feedback shift register makes use of XOR gate for tapping and providing feedback. It works by shifting and placing the feedback value. Feedback value is determined by last bit and second bit tapped and fed to XOR gate. A B XOR 0 0 0 0 1 1 1 0 1 1 1 0,https://rkokdq5fgqqf84hb.public.blob.vercel-storage.com/gate-cs/2007/Explanation_Images/79f8b1a9c777a761-eZsxi1fD2VFlCmVxKD0i6aomPdb4TN.png,Digital Logic,Combinational and sequential circuits,
62,"Following table indicates the latencies of operations between the instruction producing the result and instruction using the result. C Load R1 , Loc 1 ; Load R1 from memory location Loc1 Load R2 , Loc 2 ; Load R2 from memory location Loc 2 Add R1 , R2 , R1 ; Add R1 and R2 and save result in R1 Dec R2 ; Decrement R2 Dec R1 ; Decrement R1 Mpy R1 , R2 , R3 ; Multiply R1 and R2 and save result in R3 Store R3 , Loc 3 ; Store R3 in memory location Loc 3 What is the number of cycles needed to execute the above code segment assuming each instruction takes one cycle to execute ?",https://rkokdq5fgqqf84hb.public.blob.vercel-storage.com/gate-cs/2007/Question_Images/766e1a6581ccdd67-WnZTb3eyRsCEC2zEDjpLsPP7tzdBTI.jpg,7,,10,,13,,14,,C,MCQ,"In the given question there are 7 instructions each of which takes 1 clock cycle to complete. (Pipelining may be used) If an instruction is in execution phase and any other instruction s can’t be in the execution phase. So, atleast 7 clock cycles will be taken. Now, it is given that between two instructions latency or delay should be there based on their operation. Ex- 1 st line of the table says that between two operations in which first is producing the result of an ALU operation and the 2 nd is using the result there should be a delay of 2 clock cyles. clock cycle : 1) Load R1, Loc 1; Load R1 from memory location Loc1 Takes 1 clock cycle, simply loading R1 on loc1. 2) Load R2, Loc 2; Load R2 from memory location Loc2 Takes 1 clock cycle, simply loading r2 on loc2. 3) Add R1, R2, R1; Add R1 and R2 and save result in R1 R1=R1+R2; Hence, this instruction is using the result of R1 and R2, i.e. result of Instruction 1 and Instruction 2. As instruction 1 is load operation and instruction 3 is ALU operation. So, there should be a delay of 1 clock cycle between instruction 1 and instruction 3.Which is already there due to I2. As instruction 2 is load operation and instruction 3 is ALU operation. So, there should be a delay of 1 clock cycle between instruction 2 and instruction 3. 4) Dec R2; Decrement R2 This instruction is dependent on instruction 2 and there should be a delay of one clock cycle between Instruction 2 and Instruction 4. As instruction 2 is load and 4 is ALU . Which is already there due to Instruction 3. 5) Dec R1 Decrement R1 This instruction is dependent on Instruction 3 As Instruction I3 is ALU and I5 is also ALU so a delay of 2 clock cycles should be there between them of which 1 clock cycle delay is already there due to I4 so one clock cycle delay between I4 and I5. 6) MPY R1, R2, R3; Multiply R1 and R2 and save result in R3 R3=R1*R2; This instruction uses the result of Instruction 5, as both instruction 5 and 6 are ALU so there should be a delay of 2 clock cycles. 7) Store R3, Loc 3 Store R3 in memory location Loc3 This instruction is dependent on instruction 6 which is ALU and instruction 7 is store so there should be a delay of 2 clock cycles between them. Hence, a total of 13 clock cycles will be there.",https://rkokdq5fgqqf84hb.public.blob.vercel-storage.com/gate-cs/2007/Explanation_Images/d411818e5a1313f2-OIdB03gHXZs8doik7aqrkgWgwprJ8Q.png,Computer Organization and Architecture,Pipelining,"Instruction pipelining, pipeline hazards"
63,"An error correcting code has the following code words: 00000000, 00001111, 01010101, 10101010, 11110000. What is the maximum number of bit errors that can be corrected ?",,0,,1,,2,,3,,B,MCQ,"While transmitting the data through the channel, noise may be added to the data and thus, may cause errors in the data. Hamming code errors CANNOT be DETECTED if one code converts into another. detection possible up to ( hamming distance - 1) = 4 - 1 = 3 bits correction possible up to { [ ( hamming distance - 1) / 2 ]} = \left \lfloor\frac{Hamming \ Distance-1}{2} \right \rfloor = [Tex] \left \lfloor\frac{3}{2} \right \rfloor[/Tex] = [Tex]\left \lfloor\ 1.5 \right \rfloor[/Tex] = 1 bit Therefore, option B is the correct answer.",,Computer Networks,Data Link Layer,"Framing, error detection"
64,A hard disk system has the following parameters : Number of tracks = 500 Number of sectors/track = 100 Number of bytes /sector = 500 Time taken by the head to move from one track to adjacent track = 1 ms Rotation speed = 600 rpm. What is the average time taken for transferring 250 bytes from the disk ?,,300.5 ms,,255.5 ms,,255.0 ms,,300.0 ms,,D,MCQ,"Avg. time to transfer = Avg. seek time + Avg. rotational delay + Data transfer time Avg Seek Time -  time taken  to move from 1st track to 1sr track : 0ms, 1st to 2nd : 1ms, 2ms, 3ms,....499ms Avg Seek time =( ∑0+1+2+3+...+499)/500 = 249.5 ms Avg Rotational Delay - RMP : 600 , 600 rotations in 60 sec (one Rotation = 60/600 sec = 0.1 sec) So, Avg Rotational Delay = 0.1/2= 50 ms Data Transfer Time: In One 1 Rotation we can read data on one track = 100 * 500 = 50,000 B data is read in one rotation. 250 bytes -> 0.1 * 250 / 50,000 = 0.5 ms Therefore ATT = 249.5+50+0.5 = 300 ms",,Computer Organization and Architecture,Memory Hierarchy,"Cache, main memory and secondary storage"
65,The line T in the following figure is permanently connected to the ground. Which of the following inputs (X1 X2 X3 X4) will detect the fault ?,https://rkokdq5fgqqf84hb.public.blob.vercel-storage.com/gate-cs/2007/Question_Images/2fa5c366ebb6b7b1-OfofettY5kzokRJyQpqGdfJnxcAx97.png,0000,,0111,,1111,,None of these,,C,MCQ,"We consider circuit in two different configurations to check the inputs. And then apply the three available inputs to get output values. On doing so, we observe that all inputs give same outputs in both the configurations. Thus None of these is the answer.","https://rkokdq5fgqqf84hb.public.blob.vercel-storage.com/gate-cs/2007/Explanation_Images/9df02bbdd3613c82-CwIB2G9WCvvWyN6zlM7WzXf8HB4icC.png, https://rkokdq5fgqqf84hb.public.blob.vercel-storage.com/gate-cs/2007/Explanation_Images/0993fc83d84e0485-UhAGx3ZB8r1YVUQkqiNm5ujCEhe1mT.png, https://rkokdq5fgqqf84hb.public.blob.vercel-storage.com/gate-cs/2007/Explanation_Images/3dc6be2138e15c21-5LP6sNiKnOwYNXQ7qXAmCGwI8MR4JJ.png, https://rkokdq5fgqqf84hb.public.blob.vercel-storage.com/gate-cs/2007/Explanation_Images/e3c8838b279ff2a3-1aK1swd6DkNS9zleSfa0kvISWXbVMR.png, https://rkokdq5fgqqf84hb.public.blob.vercel-storage.com/gate-cs/2007/Explanation_Images/4633bb64cde10a21-oMptqzWcRL8EnKgp3Y48TeM8mQ5wNY.png, https://rkokdq5fgqqf84hb.public.blob.vercel-storage.com/gate-cs/2007/Explanation_Images/ce2d4b99c19ea31a-zNBRDGKiOVmo466loY6ibrPf54WELq.png",Digital Logic,Combinational and sequential circuits,
66,"The two grammars given below generate a language over the alphabet {x, y, z} Which one of the following choices describes the properties satisfied by the strings in these languages?",https://rkokdq5fgqqf84hb.public.blob.vercel-storage.com/gate-cs/2007/Question_Images/0c29a7799c62aff3-baYeHRwkDnNtujRyxkLiPfXHPERDr7.jpg,G1 : No y appears before any x G2 : Every x is followed by at least one y,,G1 : No y appears before any x G2 : No x appears before any y,,G1 : No y appears after any x G2 : Every x is followed by at least one y,,G1 : No y appears after any x G2 : Every y is followed by at least one x,,A,MCQ,"For the above question we can see that for all options, properties satisfied by the strings could be defined as some relation between x and y alphabets. For Grammar 1 , Strings with a combination of both x and y can be generated with the following form of production(s) of the grammar only. S-->xS -->xyB or S-->zS-->zxS-->zxyB (In case starting production is S-->x| z| yB, it cannot give both x and y in the string) Hence in any string with x and y both no y can appear before x can be described as a property satisfied by the strings of the language. Similarly for Grammar 2 , Strings with a combination of both x and y can be generated with the following form of production(s) of the grammar only. S-->yS -->yxB-->yxy OR S-->yS -->yxB-->yxyB S-->xB -->xy OR S-->xB -->xyB Hence in any string with x and y both every x is followed by atleast one y can be described as a property satisfied by the strings of the language.",,Theory of Computation,Language Properties,"Regular and context-free languages, pumping lemma"
67,"Consider the following DFA in which s0 is the start state and s1, s3 are the final states. What language does this DFA recognize ?",https://rkokdq5fgqqf84hb.public.blob.vercel-storage.com/gate-cs/2007/Question_Images/91076ba5650230d7-eubiIihqFhXHqss6kmY2DLjlXTSdrz.png,All strings of x and y,,All strings of x and y which have either even number of x and even number of y or odd number or x and odd number of y,,All strings of x and y which have equal number of x and y,,All strings of x and y with either even number of x and odd number of y or odd number of x and even number of y,,D,MCQ,"Alphabet x would move to S1 and alphabet y would move to S3 from S0 state. Hence smallest string accepted by the DFA are {x, y}. Further possible movements from S1 or S3 to the accepting states can be any combination of x and y of even length i.e. either of {xx, xy, yx, yy} and their combinations. Hence the language accepted by the DFA can be recognized as (x+y) + (xx+xy+yx+yy)* i.e. all strings of x and y with odd length (even no. of x and odd no. of y OR even no. of y and odd no. of x). Option elimination method: (option which has at least one example which is not accepted by DFA) Option (A): False as {xx, xy etc} are not accepted by the DFA. Option (B): False as even no. of x and even no. of y string {xxyy} is not accepted by the DFA. Option (C): False as string with equal no. of x and equal no. of y {xy} is not accepted by the DFA. Option (D): All strings with either even number of x and odd number of y or odd number of x and even number of y are accepted. Hence the answer is option (D).",,Theory of Computation,Formal Languages and Automata,Regular expressions and finite automata
68,Consider the grammar given below S      →      x B | y A A      →      x | x S | y A A B      →      y | y S | y B B Consider the following strings. (i)	 xxyyx (ii)	 xxyyxy (iii)	 xyxy (iv)	 yxxy (v)	 yxx (vi)	 xyx Which of the above strings are generated by the grammar ?,,"(i), (ii), and (iii)",,"(ii), (v), and (vi)",,"(ii), (iii), and (iv)",,"(i), (iii), and (iv)",,C,MCQ,Only iii and iv are possible.,,Theory of Computation,Formal Languages and Automata,Context-free grammars and push-down automata
69,Consider the following grammars. Names representing terminals have been specified in capital letters. Which one of the following statements is true?,https://rkokdq5fgqqf84hb.public.blob.vercel-storage.com/gate-cs/2007/Question_Images/9ecb86bdb3521ddb-do6DxcHjy7xZ3vZdVGQa6k3JUGSpv4.jpg,G 1 is context-free but not regular and G 2 is regular,,G 2 is context-free but not regular and G 1 is regular,,Both G 1 and G 2 are regular,,Both G 1 and G 2 are context-free but neither of them is regular,,D,MCQ,"Given grammars can be re-written as: Say, while = w, expr =E, stmt = S, other = o Here, we can write a right linear grammar for G 1 as S -> w(E)S S -> o E->ID So, L(G 1 ) is regular. Now for G 2 also we can write a right linear grammar: S -> w(E)S E -> E+E E -> E*E S -> o But in this question both these grammar are neither right linear nor left linear. So, option (D) is correct.",,Theory of Computation,Formal Languages and Automata,Context-free grammars and push-down automata
70,"Consider the following finite automata P and Q over the alphabet {a, b, c}. The start states are indicated by a double arrow and final states are indicated by a double circle. Let the languages recognized by them be denoted by L(P) and L(Q) respectively. The automation which recognizes the language L(P) ∩ L(Q) is :","https://rkokdq5fgqqf84hb.public.blob.vercel-storage.com/gate-cs/2007/Question_Images/edab65ab8eac3dcf-CGEVDP2g4hXK4xMOg1MhufPttgVolc.jpg, https://rkokdq5fgqqf84hb.public.blob.vercel-storage.com/gate-cs/2007/Question_Images/063c8a784eb859e8-JAJZrIlR13ifNEhQKnJYIGP4mfBD7R.jpg, https://rkokdq5fgqqf84hb.public.blob.vercel-storage.com/gate-cs/2007/Question_Images/db13732c954aba8b-EhJbloSW27uKVloYt5OVD0xERumXRP.jpg, https://rkokdq5fgqqf84hb.public.blob.vercel-storage.com/gate-cs/2007/Question_Images/73683a58550d6fde-o4Y5g4oDQwJiVDPln5ewrHeyHKNnx2.jpg, https://rkokdq5fgqqf84hb.public.blob.vercel-storage.com/gate-cs/2007/Question_Images/74e7eef3aa302087-XAHSIzcKLXCO9fpuqtTq8cMx2S98kt.jpg",a,,b,,c,,d,,A,MCQ,Both accepts strings starting with a or b so option (D) cancels out.  Common string accept by both L(P) and L(Q) is “baa”.,,Theory of Computation,Formal Languages and Automata,Regular expressions and finite automata
71,(C012.25) H - (10111001110.101) B =,,(135103.412) o,,(564411.412) o,,(564411.205) o,,(135103.205) o,,A,MCQ,(C012.25) H - (10111001110.101) B =   1100 0000 0001 0010. 0010 0101 (convert each digit of hexa to 4 bit binary) - 0000 0101 1100 1110. 1010 0000 =   1011 1010 0100 0011. 1000 0101 =   1 011 101  001 000 011 . 100 001 010 (make pairing of 3 to convert in octal) = (135103.412) o,,Digital Logic,Number representations and computer arithmetic (fixed and floating point),
72,"Synchronization in the classical readers and writers problem can be achieved through use of semaphores. In the following incomplete code for readers-writers problem, two binary semaphores mutex and wrt are used to obtain synchronization wait (wrt) writing is performed signal (wrt) wait (mutex) readcount = readcount + 1 if readcount = 1 then S1 S2 reading is performed S3 readcount = readcount - 1 if readcount = 0 then S4 signal (mutex) The values of S1, S2, S3, S4, (in that order) are",,"signal (mutex), wait (wrt), signal (wrt), wait (mutex)",,"signal (wrt), signal (mutex), wait (mutex), wait (wrt)",,"wait (wrt), signal (mutex), wait (mutex), signal (wrt)",,"signal (mutex), wait (mutex), signal (mutex), wait (mutex)",,C,MCQ,"For S1: if readcount =1 => reader is reading now, so no writer must execute. Hence, S1 has to be wait(wrt) For S2: After readcount has been updated, is made to 1, so other readers can enter into entry section. Multiple readings are allowed. (Only 1 at a time can be in entry section ) hence signal(mutex) For S3: Now at a time only one process can be in Exit section and semaphore mutex is used to implement it (only 1 at a time can be in exit section).Hence wait(mutex) For S4: If readcount is zero i.e no reader is reading, means last reader has completed reading, it should unlock resources so that any writer waiting for it can use it .hence signal(wrt).The above values of S1, S2, S3, and S4 are all nothing but implementing first reader writer problem.",,Operating System,Core Concepts,Concurrency and Synchronization
