Question_Number,Question_Text,Question_Images,Option_A,Option_A_Images,Option_B,Option_B_Images,Option_C,Option_C_Images,Option_D,Option_D_Images,Correct_Answer,Question_Type,Explanation,Explanation_Images,subject,chapter,subtopic
1,Processes P 1 and P 2 use critical_flag in the following routine to achieve mutual exclusion. Assume that critical_flag is initialized to FALSE in the main program. get_exclusive_access ( ) {     if (critical _flag == FALSE) {         critical_flag = TRUE ;         critical_region () ;         critical_flag = FALSE;     } } Consider the following statements. i. It is possible for both P 1 and P 2 to access critical_region concurrently. ii. This may lead to a deadlock. Which of the following holds?,,(i) is false and (ii) is true,,Both (i) and (ii) are false,,(i) is true and (ii) is false,,Both (i) and (ii) are true,,C,MCQ,"Say P 1 starts first and executes statement 1, after that system context switches to P 2 (before executing statement 2), and it enters inside if statement, since the flag is still false.  So now both processes are in critical section! so (i) is true.. (ii) is false  By no way it happens that flag is true and no process are inside the if clause, if someone enters the critical section, it will definitely make flag = false. So no deadlock.",https://rkokdq5fgqqf84hb.public.blob.vercel-storage.com/gate-cs/2007/Explanation_Images/d4e7b680c0a668ba-52aiz3BFgMdjtEnmYrW4Bp3ohQLjzQ.png,Operating System,Core Concepts,Concurrency and Synchronization
2,"Consider the following program: C++ #include <iostream> #include <cctype> #include <stack> #define EOF -1 std :: stack < int > s ; void push ( int value ) { s . push ( value ); } /* push the argument on the stack */ int pop ( void ) { if ( s . empty ()) return EOF ; int value = s . top (); s . pop (); return value ; } /* pop the top of the stack */ void flagError () { std :: cerr << ""Error!"" << std :: endl ; exit ( 1 ); } int main () { int c , m , n , r ; while (( c = std :: cin . get ()) != EOF ) { if ( isdigit ( c )) push ( c - '0' ); else if (( c == '+' ) || ( c == '*' )) { m = pop (); n = pop (); r = ( c == '+' ) ? n + m : n * m ; push ( r ); } else if ( c != ' ' ) flagError (); } std :: cout << pop () << std :: endl ; } C #include <stdio.h> #include <stdlib.h> #include <ctype.h> #define EOF -1 #define MAX_STACK_SIZE 100 int s [ MAX_STACK_SIZE ]; int top = -1 ; void push ( int value ) { if ( top < MAX_STACK_SIZE - 1 ) s [ ++ top ] = value ; } /* push the argument on the stack */ int pop ( void ) { if ( top == -1 ) return EOF ; return s [ top -- ]; } /* pop the top of the stack */ void flagError () { fprintf ( stderr , ""Error! \n "" ); exit ( 1 ); } int main () { int c , m , n , r ; while (( c = getchar ()) != EOF ) { if ( isdigit ( c )) push ( c - '0' ); else if (( c == '+' ) || ( c == '*' )) { m = pop (); n = pop (); r = ( c == '+' ) ? n + m : n * m ; push ( r ); } else if ( c != ' ' ) flagError (); } printf ( ""%d \n "" , pop ()); } Java import java.util.* ; public class Main { static Stack < Integer > stack = new Stack <> (); static void push ( int value ) { stack . push ( value ); } /* push the argument on the stack */ static int pop () { return stack . isEmpty () ? - 1 : stack . pop (); } /* pop the top of the stack */ static void flagError () { System . err . println ( ""Error!"" ); System . exit ( 1 ); } public static void main ( String [] args ) { Scanner scanner = new Scanner ( System . in ); int c , m , n , r ; while (( c = scanner . next (). charAt ( 0 )) != - 1 ) { if ( Character . isDigit ( c )) push ( c - '0' ); else if ( c == '+' || c == '*' ) { m = pop (); n = pop (); r = ( c == '+' ) ? n + m : n * m ; push ( r ); } else if ( c != ' ' ) flagError (); } System . out . println ( pop ()); } } Python class Stack : def __init__ ( self ): self . items = [] def push ( self , item ): self . items . append ( item ) # push the argument on the stack def pop ( self ): return self . items . pop () if self . items else - 1 # pop the top of the stack def flagError (): print ( ""Error!"" ) exit ( 1 ) s = Stack () while True : try : c = input () if c == '' : break c = ord ( c ) if c >= ord ( '0' ) and c <= ord ( '9' ): s . push ( c - ord ( '0' )) elif c == ord ( '+' ) or c == ord ( '*' ): m = s . pop () n = s . pop () r = n + m if c == ord ( '+' ) else n * m s . push ( r ) elif c != ord ( ' ' ): flagError () except EOFError : break print ( s . pop ()) JavaScript class Stack { constructor () { this . items = []; } push ( item ) { this . items . push ( item ); } /* push the argument on the stack */ pop () { return this . items . length === 0 ? - 1 : this . items . pop (); } /* pop the top of the stack */ } function flagError () { console . error ( 'Error!' ); process . exit ( 1 ); } const stack = new Stack (); process . stdin . on ( 'data' , function ( data ) { const input = data . toString (); for ( let c of input ) { if ( ! isNaN ( c )) { stack . push ( parseInt ( c )); } else if ( c === '+' || c === '*' ) { const m = stack . pop (); const n = stack . pop (); const r = ( c === '+' ) ? n + m : n * m ; stack . push ( r ); } else if ( c !== ' ' ) { flagError (); } } }); process . stdin . on ( 'end' , function () { console . log ( stack . pop ()); }); What is the output of the program for the following input ? 5 2 * 3 3 2 + * +",,15,,25,,30,,150,,B,MCQ,"The function of the program is:- 1) If the current character is a digit it pushes into stack 2) Else if the current character is operator,  it pops two elements and then performs the operation. Finally it pushes the resultant element into stack. Initially stack s is empty. 5 2 * 3 3 2 + * + 1) 5 -> It pushes into s 2) 2 -> It pushes into s 3) * -> It pops two elements n = 2, m=5 n*m = 10 It pushes 10 into s 4) 3 -> It pushes into s 5) 3 -> It pushes into s 6) 2 -> It pushes into s 7) + -> n=2, m=3 n+m=5 It pushes 5 into s 8) * -> n=5, m=3 n*m=15 It pushes 15 into s 9) + -> n=15, m=10 n+m = 25 It pushes 25 into s. Result = 25",,Programming and Data Structures,Linear Data Structures,"Arrays, stacks, queues, linked lists"
3,"Consider the C program given below : C #include <stdio.h> int main () { int sum = 0 , maxsum = 0 , i , n = 6 ; int a [] = { 2 , -2 , -1 , 3 , 4 , 2 }; for ( i = 0 ; i < n ; i ++ ) { if ( i == 0 || a [ i ] < 0 || a [ i ] < a [ i - 1 ]) { if ( sum > maxsum ) maxsum = sum ; sum = ( a [ i ] > 0 ) ? a [ i ] : 0 ; } else sum += a [ i ]; } if ( sum > maxsum ) maxsum = sum ; printf ( ""%d \\ n"" , maxsum ); } What is the value printed out when this program is executed?",,9,,8,,7,,6,,C,MCQ,"If you look for loop carefully, you will notice that it assigns sum variable to some value in if condition and increments it in the else condition. On further thought, it would be clear that this loop stores sum of increasing subsequence of positive integers in sum variable and max of sum in maxsum. Hence, maxsum - maximum sum of increasing subsequence of positive integers will get printed out when this program is executed, which is 3 + 4 = 7. //output will be 3+4 =7 {for || if 1st argument is true 2nd argument will not be calculated, and if 1st argument is false, 2nd argument will be calculated} Another Solution When i=1 -> i==0 is false, but a[i]<0 is true so condition (1) is true.Now if (sum > maxsum) is true, since sum=2 and maxsum=0.So maxsum=2. sum = (a [i] > 0) ? a [i] : 0; , sum=0 since a[i]<0. When i=2 -> i==0 is false, a[i]<0 is true and so condition (1) is true.Now if (sum > maxsum) is false, since sum=0 and maxsum=2.Since sum = (a [i] > 0) ? a [i] : 0; , sum=0 since a[i]<0. When i=3 -> i==0 is false , a[i]<0 is false and a [i] < a [i – 1] is false so condition (1) is false. Now sum += a [i] = 3. When i=4 -> i==0 is false , a[i]<0 is false and a [i] < a [i – 1] is false so condition (1) is false. Now sum += a [i] = 7. When i=5 -> i==0 is false , a[i]<0 is false and a [i] < a [i – 1] is true so condition (1) is true. sum > maxsum is true, since sum=7 and maxsum=2,so maxsum=7.Since sum = (a [i] > 0) ? a [i] : 0, so sum=2 since a[5]>0.",,Programming and Data Structures,Programming in C,
4,"The address sequence generated by tracing a particular program executing in a pure demand paging system with 100 bytes per page is 0100, 0200, 0430, 0499, 0510, 0530, 0560, 0120, 0220, 0240, 0260, 0320, 0410. Suppose that the memory can store only one page and if x is the address which causes a page fault then the bytes from addresses x to x + 99 are loaded on to the memory. How many page faults will occur ?",,0,,4,,7,,8,,C,MCQ,"Address	        Page faults	last byte in memory 0100 		page fault, 	 199 0200 		page fault, 	 299 0430		page fault,      529 0499 		no page fault 0510 		no page fault 0530 		page fault,     629 0560            no page fault 0120 		page fault,     219 0220	 	page fault,     319 0240            no page fault 0260            no page fault 0320		page fault,     419 0410            no page fault So, 7 is the answer- (C)",,Operating System,Memory Management,Virtual Memory
5,The minimum positive integer p such that 3 p modulo 17 = 1 is,,5,,8,,12,,16,,D,MCQ,Either use Fermat's Little Theorem or put the value of p and get the answer.  Option (D) is correct.,,Engineering Mathematics,Discrete Mathematics,Algebraic Structures
6,"The function f is defined as follows: C++ int f ( int n ) { if ( n <= 1 ) return 1 ; else if ( n % 2 == 0 ) return f ( n / 2 ); else return f ( 3 * n - 1 ); } C int f ( int n ) { if ( n <= 1 ) return 1 ; else if ( n % 2 == 0 ) return f ( n / 2 ); else return f ( 3 n - 1 ); } Java int f ( int n ) { if ( n <= 1 ) return 1 ; else if ( n % 2 == 0 ) return f ( n / 2 ); else return f ( 3 * n - 1 ); } Python def f ( n ): if n <= 1 : return 1 elif n % 2 == 0 : return f ( n // 2 ) else : return f ( 3 * n - 1 ) JavaScript function f ( n ) { if ( n <= 1 ) return 1 ; else if ( n % 2 === 0 ) return f ( n / 2 ); else return f ( 3 * n - 1 ); } Assuming that arbitrarily large integers can be passed as a parameter to the function, consider the following statements. 1. The function f terminates for finitely many different values of n ≥ 1. ii. The function f terminates for infinitely many different values of n ≥ 1. iii. The function f does not terminate for finitely many different values of n ≥ 1. iv. The function f does not terminate for infinitely many different values of n ≥ 1. Which one of the following options is true of the above?",,(i) and (iii),,(i) and (iv),,(ii) and (iii),,(ii) and (iv),,D,MCQ,"The function terminates for all values having a factor of 2 {(2.x)2==0} So, (i) is false and (ii) is TRUE. Let n = 3, it will terminate in 2nd iteration. Let n=5, it will go like 5 - 14 - 7 - 20 - 10 - 5 – and now it will repeat. And any number with a factor of 5 and 2, there are infinite recursions possible. So, (iv) is TRUE and (iii) is false. Hence Option(D) is the correct Option.",,Theory of Computation,Computability,Turing machines and undecidability
7,Consider a weighted undirected graph with positive edge weights and let uv be an edge in the graph. It is known that the shortest path from the source vertex s to u has weight 53 and the shortest path from s to v has weight 65. Which one of the following statements is always true?,,"weight (u, v) < 12",,"weight (u, v) ≤ 12",,"weight (u, v) > 12",,"weight (u, v) ≥ 12",,D,MCQ,"The minimum weight happens when (S,U) + (U,V) = (S,V)  Else (S,U) + (U,V) >= (S,V)  Given (S,U) = 53, (S,V) = 65  53 + (U,V) >= 63  (U,V) >= 12.   This solution is contributed by Anil Saikrishna Devarasetty",https://rkokdq5fgqqf84hb.public.blob.vercel-storage.com/gate-cs/2007/Explanation_Images/db6740b6923cf66a-3Egup2WCHDibT16giKtOzaZWUXa14x.png,Algorithms,Graph Algorithms,"Graph traversals, minimum spanning trees, shortest paths"
8,"Consider the program below in a hypothetical language which allows global variable and a choice of call by reference or call by value methods of parameter passing. C int i ; program main () { int j = 60 ; i = 50 ; call f ( i , j ); print i , j ; } procedure f ( x , y ) { i = 100 ; x = 10 ; y = y + i ; } Which one of the following options represents the correct output of the program for the two parameter passing mechanisms?",,"Call by value : i = 70, j = 10; Call by reference : i = 60, j = 70",,"Call by value : i = 50, j = 60; Call by reference : i = 50, j = 70",,"Call by value : i = 10, j = 70; Call by reference : i = 100, j = 60",,"Call by value : i = 100, j = 60; Call by reference : i = 10, j = 70",,D,MCQ,"Call by value: A copy of parameters will be passed and whatever updations are performed will be valid only for that copy, leaving original values intact. Call by reference: A link to original variables will be passed, by allowing the function to manipulate the original variables.",,Compiler Design,Runtime Environments,
9,Which of the following input sequences for a cross-coupled R-S flip-flop realized with two NAND gates may lead to an oscillation ?,,"11, 00",,"01, 10",,"10, 01",,"00, 11",,D,MCQ,"RS flip flop using NAND gates. So, 00 input causes indeterminate state which MAY lead to oscillation.",,Digital Logic,Combinational and sequential circuits,
10,"The following circuit implements a two-input AND gate using two 2-1 multiplexers. What are the values of X 1 , X 2 , X 3 ?",,"X 1 =b, X 2 =0, X 3 =a",,"X 1 =b, X 2 =1, X 3 =b",,"X 1 =a, X 2 =b, X 3 =1",,"X 1 =a, X 2 =0, X 3 =b",,A,MCQ,"F = (bX 1 ' + aX 1 )X 3 + X 2 X 3 ' By putting following values:  X 1 = b, X 2 = 0, X 3 = a We will get F = ab.",https://rkokdq5fgqqf84hb.public.blob.vercel-storage.com/gate-cs/2007/Explanation_Images/9abdf67a0a289e24-b3UrGNtkFWqmsC9V6TddBIQUxdBZlQ.jpg,Digital Logic,Combinational and sequential circuits,
11,Consider an ambiguous grammar G and its disambiguated version D. Let the language recognized by the two grammars be denoted by L(G) and L(D) respectively. Which one of the following is true ?,,L (D) ⊂ L (G),,L (D) ⊃ L (G),,L (D) = L (G),,L (D) is empty,,C,MCQ,"By changing grammar, language will not change here. {as converting NFA to DFA language will not be changed}",,Theory of Computation,Formal Languages and Automata,Context-free grammars and push-down automata
12,"The trapezoidal method is used to evaluate the numerical value of [Tex]\int_0^1 e^x\,dx  [/Tex] .  Consider the following values for the step size h. i.   10 -2 ii.      10 -3 iii. 10 -4 iv.  10 -5 For which of these values of the step size h, is the computed value guaranteed to be correct to seven decimal places. Assume that there are no round-off errors in the computation.",,(iv) only,,(iii) and (iv) only,,"(ii), (iii) and (iv) only",,"(i), (ii), (iii) and (iv)",,B,MCQ,,,Engineering Mathematics,Calculus,Integration
13,"A processor takes 12 cycles to complete an instruction I. The corresponding pipelined processor uses 6 stages with the execution times of 3, 2, 5, 4, 6 and 2 cycles respectively. What is the asymptotic speedup assuming that a very large number of instructions are to be executed?",,1.83,,2,,3,,6,,B,MCQ,"For non pipeline processor, It takes, 12 cycles to complete 1 instruction So, for n instructions it will take 12n cycle For pipelined processor, Each stage time = max{each stage cycles} = max{3, 2, 5, 4, 6 and 2} = 6 cycles So, for n instructions it will take = 6*6+ (n-1)*6    {6*6 for 1st instruction and for rest of n-1 it will take 6} For a large number of instructions: Lim n->∞ 12n/36 + (n-1)*6 = 12/6 =2",,Computer Organization and Architecture,Pipelining,"Instruction pipelining, pipeline hazards"
14,Which of the following systems is a most likely candidate example of a pipe and filter architecture ?,,Expert system,,DB repository,,Aircraft flight controller,,Signal processing,,D,MCQ,"Pipe and Filters In the pipes and filters pattern, components are filters and connectors are pipes. Each filter takes input insome form and produces output in some other form,  which may or may not be similar to the input form.Hopefully,each filter will add  value to the output stream because of processing done inside the filter. Each filter  is independent and is unaware of the up and down stream filters. Pipes are conduits  of the data streams. Famous example of the pipes and filters architectural pattern are UNIX shells,signal processing systems and distributed systems.",,,,
15,Consider the following statements about the timeout value used in TCP. i. The timeout value is set to the RTT (Round Trip Time) measured during TCP connection establishment for the entire duration of the connection. ii. Appropriate RTT estimation algorithm is used to set the timeout value of a TCP connection. iii. Timeout value is set to twice the propagation delay from the sender to the receiver. Which of the following choices hold?,,"(i) is false, but (ii) and (iii) are true",,"(i) and (iii) are false, but (ii) is title",,"(i) and (ii) are false, but (iii) is true",,"(i), (ii) and (iii) are false",,B,MCQ,"Time-out timer in TCP: One can’t use static timer used in data link layer (DLL), which is HOP to HOP connection, since nobody knows how many hops are there in the path form sender to receiver as it uses IP service and path may vary time to time. So, dynamic timers are used in TCP. Time-out timer should increase or decrease depending on traffic to avoid unnecessary congestion due to retransmissions. There are three algorithms are for this purpose: 1. Basic algorithm 2. Jacobson’s algorithm 3. Karl’s modification. Solution: The timeout value is set to the RTT (Round Trip Time) measured during TCP connection establishment for the entire duration of the connection.- FALSE The timeout value can’t be fixed for entire duration as it will turn timer to static timer, we need dynamic timer for timeout. Appropriate RTT estimation algorithm is used to set the timeout value of a TCP connection.-TRUE Yes, all three algorithm are appropriate RTT estimation algorithm used to set timeout value dynamically. Timeout value is set to twice the propagation delay from the sender to the receiver.-FALSE This statement is false because, timeout value is set to twice the propagation delay in data link layer where, hop to hop distance is known, not in TCP layer. This solution is contributed by S andeep pandey .",,Computer Networks,Transport Layer,"UDP, TCP, sockets"
16,"Consider a TCP connection in a state where there are no outstanding ACKs. The sender sends two segments back to back. The sequence numbers of the first and second segments are 230 and 290 respectively. The first segment was lost, but the second segment was received correctly by the receiver. Let X be the amount of data carried in the first segment (in bytes), and Y be the ACK number sent by the receiver. The values of X and Y (in that order) are",,60 and 290,,230 and 291,,60 and 231,,60 and 230,,D,MCQ,"data in 1st segment is from byte number 230 to byte number 289, that is 60 bytes As 1st is lost so, TCP will send ACK for the next in-order segment receiver is expecting. So it will be for 230.",,Computer Networks,Transport Layer,"UDP, TCP, sockets"
17,"A firewall is to be configured to allow hosts in a private network to freely open TCP connections and send packets on open connections. However, it will only allow external hosts to send packets on existing open TCP connections or connections that are being opened (by internal hosts) but not allow them to open TCP connections to hosts in the private network. To achieve this the minimum capability of the firewall should be that of",,A combinational circuit,,A finite automaton,,A pushdown automaton with one stack,,A pushdown automaton with two stacks,,D,MCQ,"A) A combinational circuit => Not possible, because we need memory in Firewall, Combinational ckt has none. B) A finite automaton => We need infinite memory, there is no upper limit on Number of TCP ckt so Not this. C) A pushdown automaton with one stack => Stack is infinite. Suppose we have 2 connections , we have pushed details of those on stack we can not access the details of connection which was pushed first, without popping it off. So Big  NO. D) pushdown automaton with two stacks => This is TM. It can do everything our normal computer can do so Yes. Firewall can be created out of TM.",,Computer Networks,Network Layer,
18,"In the Spiral model of software development, the primary determinant in selecting activities in each iteration is",,Iteration size,,Cost,,Adopted process such as Rational Unified Process or Extreme Programming,,Risk,,D,MCQ,Spiral model is used to discover all risks associated as early as possible.,,,,
19,Which one of these first-order logic formula is valid?,,∀x(P(x) => Q(x)) => (∀xP(x) => ∀xQ(x)),,∃x(P(x) ∨ Q(x)) => (∃xP(x) => ∃xQ(x)),,∃x(P(x) ∧ Q(x)) <=> (∃xP(x) ∧ ∃xQ(x)),,"∀x∃y P(x, y) => ∃y∀x P(x, y)",,A,MCQ,"(A) LHS->RHS LHS: For every x (if P holds then Q holds) RHS: If P(x) holds for all x, then Q(x) holds for all x. (B) LHS !->RHS LHS: An x exist for which either P(x) is true or Q(x) is true. RHS: If an x exist for which P(x) is true then another x exist for which Q(x) is true. (C) It is not necessary that on RHS both x are same. LHS: There exist an x for which both P(x) and Q(x) are true. RHS: There exist an x for which P(x) is true and there exist an x for which Q(x) is true. (D) LHS!->RHS LHS: For every x, there exist a y such that P(x, y) holds. RHS: There exist a y such that for all x P(x, y) holds.",,Engineering Mathematics,Discrete Mathematics,Propositional and first order logic
20,"Exponentiation is a heavily used operation in public key cryptography. Which of the following options is the tightest upper bound on the number of multiplications required to compute b n mod m,0≤b,n≤m ?",,O(logn),,O(√n),,O(n/logn),,O(n),,A,MCQ,"This Problem can be solved using Divide And Conquer Paradigm  Algorithm : Binary_exp(b,n)                            // Compute bn mod m { if(n == 0) Return 1; Else if(n == 1) Return b mod m; Else { Half = Binary_exp(b,n/2); if(n%2 == 0)                                // n is even Return (Half*Half) mod m; Else                                    // n is odd Return (((Half*Half) mod m)*n) mod m; } } Recurrence Relation for computing the time complexity of the above given algorithm is T(n) = T(n/2) + constant = (log2n)",,Computer Networks,Security,Public key cryptography
21,Consider the following two statements: i. A hash function (these are often used for computing digital signatures) is an injective function. A. encryption technique such as DES performs a permutation on the elements of its input alphabet. Which one of the following options is valid for the above two statements?,,Both are false,,Statement (i) is true and the other is false,,Statement (ii) is true and the other is false,,Both are true,,C,MCQ,"Injective Function: A function F(X) is said to be injective if it has one-to-one mapping. Statement 1: Hash function is an injective function Statement 2: DES Encryption technique performs a permutation on the elements of its input alphabet 1) Generally, a hash function H(X) is mapping from a larger set to a predefined output set For example, let H(X) = (X)%5 The above function H(X) is not injective because Let X1 = 10, X2 = 15 H(10) = H(15) = 0 As the output of H(X1) = H(X2) where X1!= X2 => H(X) is many-to-one function. Statement 1 is false. 2) In DES encryption scheme, it performs P-Box permutation. Statement 1 is false, Statement 2 is true.",,Computer Networks,Security,Symmetric key cryptography
22,"Consider n jobs J 1 , J 2 ,......J n such that job J i has execution time t i and a non-negative integer weight w i . The weighted mean completion time of the jobs is defined to be [Tex] \frac{\sum_{i=1}^{n} w_i T_i}{\sum_{i=1}^{n} w_i}[/Tex] , where T i is the completion time of job J i . Assuming that there is only one processor available, in what order must the jobs be executed in order to minimize the weighted mean completion time of the jobs?",,Non-decreasing order of t i,,Non-increasing order of w i,,Non-increasing order of w i t i,,None-increasing order of w i /t i,,D,MCQ,,,Algorithms,Design Techniques,"Greedy, dynamic programming and divide-and-conquer"
