Question_Number,Question_Text,Question_Images,Option_A,Option_A_Images,Option_B,Option_B_Images,Option_C,Option_C_Images,Option_D,Option_D_Images,Correct_Answer,Question_Type,Explanation,Explanation_Images,subject,chapter,subtopic
23,"A partial order P is defined on the set of natural numbers as follows. Here x/y denotes integer division. i.  (0, 0) ∊ P. ii. (a, b) ∊ P if and only if a % 10 ≤ b % 10 and (a/10, b/10) ∊ P. Consider the following ordered pairs: i.   (101, 22) ii.  (22, 101) iii. (145, 265) iv.  (0, 153) Which of these ordered pairs of natural numbers are contained in P?",,(i) and (iii),,(ii) and (iv),,(i) and (iv),,(iii) and (iv),,D,MCQ,"Let's analyze the partial order P defined on natural numbers based on the given rules: (0,0)∈P, meaning that the pair (0,0) is included in P. For (a,b)∈P, the following conditions must hold: a%10≤b%10 (i.e., the last digit of a is less than or equal to the last digit of b). (a/10,b/10)∈P (this means we apply integer division by 10 and check the condition recursively). Now, let’s check each of the given ordered pairs: 1 .(101,22) Last digits: 101%10=1, 22%10=2. Since 1≤2, we proceed. Now check the next pair (101/10,22/10)=(10,2). Last digits: 10%10=0, 2%10=2. Since 0≤2, we proceed. Now check the next pair (10/10,2/10)=(1,0). Last digits: 1%10=1, 0%10=0. Since [Tex]1 \nleq 0[/Tex] , this pair does not satisfy the condition. Thus, (101,22)∉P. 2 .(22,101) Last digits: 22%10=2, 101%10=1. Since [Tex]2 \nleq 1[/Tex] , the condition fails right at the first check. Thus, (22,101)∉. 3. (145,265) Last digits: 145%10=5, 265%10=5. Since 5≤5, we proceed. Now check the next pair (145/10,265/10)=(14,26). Last digits: 14%10=4, 26%10=6. Since 4≤6, we proceed. Now check the next pair (14/10,26/10)=(1,2). Last digits: 1%10=1, 2%10=2. Since 1≤2, we proceed. Now check the next pair (1/10,2/10)=(0,0). (0,0)∈P by definition. Thus, (145,265)∈P. 4. (0,153) Last digits: 0%10=0, 153%10=3. Since 0≤3, we proceed. Now check the next pair (0/10,153/10)=(0,15). Last digits: 0%10=0, 15%10=5. Since 0≤5, we proceed. Now check the next pair (0/10,15/10)=(0,1). Last digits: 0%10=0, 1%10=1. Since 0≤1, we proceed. Now check the next pair (0/10,1/10)=(0,0). (0,0)∈P by definition. Thus, (0,153)∈P. So, the correct answer is: iii. (145, 265) iv. (0, 153).",,Engineering Mathematics,Discrete Mathematics,"Sets, relations, functions, partial orders and lattices"
24,"In a multi-user operating system on an average, 20 requests are made to use a particular resource per hour. The arrival of requests follows a Poisson distribution. The probability that either one, three or five requests are made in 45 minutes is given by :",,6.9 × 10 6 × e -20,,1.02 × 10 6 × e -20,,6.9 × 10 3 × e -20,,1.02 × 10 3 × e -20,,B,MCQ,"In 1 hr. requests received =20 So in 45 min requests received = 15 So, lemda = 15 So, using poisson distribution formula: P(x; μ) = (e -μ ) (μ x ) / x! p(one request) + p(3 request) + p(5 request) = p(1; 15) + p(3; 15) + p(5; 15) = 6.9 * 10 3 * e -15 = 1.02 × 10 6 × e -20",,Engineering Mathematics,Probability and Statistics,"Uniform, normal, exponential, poisson and binomial distributions"
25,Consider the following clauses:  i. Not inherently suitable for client authentication.  ii. Not a state sensitive protocol.  iii. Must be operated with more than one server.  iv. Suitable for structured message organization.  v. May need two ports on the serve side for proper operation.  The option that has the maximum number of correct matches is,,"IMAP-(i),	 FTP-(ii),	 HTTP-(iii),	 DNS-(iv),	 POP3-(v)",,"FTP-(i),	 POP3-(ii),	 SMTP-(iii),	 HTTP-(iv),	 IMAP-(v)",,"POP3-(i),	 SMTP-(ii),	 DNS-(iii),	 IMAP-(iv),	 HTTP-(v)",,"SMTP-(i),	 HTTP-(ii),	 IMAP-(iii),	 DNS-(iv),	 FTP-(v)",,D,MCQ,"FTP need to open two ports at server, 1 for control information at 21 and another for data.  SMTP- Not suitable for client authentication ,SMTP AUTH an extension is provided for authentication now. HTTP- It doesn’t depend on the state of the device or OS. IMAP- It includes a central server ,hence must have more than one server DNS- Suitable for structured message organization. FTP – needs port 20 and 21 for control and data.",,Computer Networks,Application Layer,"DNS, HTTP, SMTP, FTP, POP"
26,"Consider the following relation schemas : b-Schema = (b-name, b-city, assets) a-Schema = (a-num, b-name, bal) d-Schema = (c-name, a-number) Let branch, account and depositor be respectively instances of the above schemas. Assume that account and depositor relations are much bigger than the branch relation. Consider the following query:  П c-name (σ b-city = ""Agra"" ⋀ bal < 0 (branch ⋈ (account ⋈ depositor)  Which one of the following queries is the most efficient version of the above query ?",,"П c-name (σ bal < 0 (σ b-city = ""Agra"" branch ⋈ account) ⋈ depositor)",,"П c-name (σ b-city = ""Agra"" branch ⋈ (σ bal < 0 account ⋈ depositor))",,"П c-name (σ b-city = ""Agra"" branch ⋈ σ b-city = ""Agra"" ⋀  bal < 0 account) ⋈ depositor)",,"П c-name (σ b-city = ""Agra"" ⋀  bal < 0 account ⋈ depositor))",,A,MCQ,"For better record processing, We should always do select before join to avoid unnecessary tuples being considered for join.(For an SQL query this is not strictly required as DBMS will rearrange the query to make it efficient) and processing a smaller table gives more efficiency than the larger one. option (A) : П c-name (σ bal < 0 (σ b-city = ""Agra"" branch ⋈ account) ⋈ depositor) here we are doing join between relatively smaller table(branch) and larger one(account) and the output that this inner table gives (which is smaller in comparison to joins that we are doing in B) is used for join with depositor table with the selection condition.(same as given query). option (B) : П c-name (σ b-city = ""Agra"" branch ⋈ (σ bal < 0 account ⋈ depositor)) here we are doing a join between two massive table account and depositor with selection condition(for balance less than zero) and the output that this inner table gives is used for join with branch table(relatively smaller table) with the selection condition (for city Agra). (same as given query) so option A and option B both are same as given query but there is difference between record processing as the record processing of option A will get reduced by some rate. (as filtered conditions are applied after the join between one smaller and one larger table which will give relatively smaller table than the join of two larger tables). So, overall option A is much better than option B. option (C) : П c-name ((σ b-city = ""Agra"" branch ⋈ σ b-city = ""Agra"" depositor) Incorrect as there is no b-city column in a-Schema. option (D) : П c-name (σ b-city = ""Agra"" branch ⋈ (σ b-city = ""Agra"" depositor)) Incorrect as there is no b-city column in a-Schema. ⋀ bal < 0 account) ⋈ ⋀ bal < 0 account ⋈ Note: don't miss this sentence ""account and depositor relations are much bigger than the branch relation"" because That makes A the best answer.",,Databases,Data Models,Relational model
27,"Consider the following implications relating to functional and multivalued dependencies given below, which may or may not be correct. i.   If A ↠ B and A ↠ C then A → BC ii.  If A → B and A → C then A ↠ BC iii. If A ↠ BC and A → B then A → C iv.  If A → BC and A → B then A ↠ C Exactly how many of the above implications are valid?",,0,,1,,2,,3,,C,MCQ,,,Databases,Database Design,"Integrity constraints, normal forms"
28,"Consider the following two transactions : T 1 and T 2 . Which of the following schemes, using shared and exclusive locks, satisfy the requirements for strict two phase locking for the above transactions?","https://rkokdq5fgqqf84hb.public.blob.vercel-storage.com/gate-cs/2007/Question_Images/4d040c4c1b448e09-pW6HXNJRDuQ2a3VSFlA9KD1Ay9UsBW.jpg, https://rkokdq5fgqqf84hb.public.blob.vercel-storage.com/gate-cs/2007/Question_Images/7a4d1e15653f42ef-iHhGwnIro2EfF7T9rbDsBxX8XU51W8.jpg, https://rkokdq5fgqqf84hb.public.blob.vercel-storage.com/gate-cs/2007/Question_Images/bc721cc1848da2c8-pqeML1DckZwyJUlJ0YGlKsboRqDOXf.jpg",A,,B,,C,,D,,C,MCQ,"Shared locks are used for Read,exclusive locks are used for Write data. one exclusive lock can not take other exclusive lock which is already taken by other schedule as it will lead to deadlock. Requirements to follow Strict 2PL: 1. Exclusive locks should be released after the commit (Releasing exclusive lock after commit restrict the deadlock condition. i.e. we cannot get lock on item were exclusive lock already taken. 2. No Locking can be done after the first Unlock and vice versa.  option (A): Incorrect because to write B,S1 needs exclusive lock on B and to write A,S2 needs exclusive Lock on A. that's why it is incorrect. option (B): Incorrect because one exclusive lock cannot take other's Exclusive Lock. here, S1 has taken exclusive lock on item A, S2 has taken exclusive lock on item B so now S1 can't take exclusive lock on item B and S2 can't take exclusive lock on item A. that's why it is incorrect. option (C): Correct as it is following all the three requirement for strict 2PL. Here,schedule S1 releases exclusive lock on B after commit and schedule S2 releases exclusive lock on A after commit.(condition 1 satisfied) option(D): incorrect as according to condition 1,Exclusive locks should be released after the commit. here,schedule S1 releases exclusive lock on B before commit and schedule S2 releases exclusive lock on A before commit. Hence it is incorrect.",,Databases,Transactions,Transactions and concurrency control
29,"Consider a selection of the form σA≤100(r), where r is a relation with 1000 tuples. Assume that the attribute values for A among the tuples are uniformly distributed in the interval [0, 500]. Which one of the following options is the best estimate of the number of tuples returned by the given selection query ?",,50,,100,,150,,200,,D,MCQ,"Here σ A<=100 signifies a selection query which selects all the tuples which has attribute A’s value less than or equal to 100. Attribute A’s values in the range [0,500] are uniformaly distributed among 1000 tuples. So first when we arrange all 1000 tuples in the ascending order of attribute A’s value, then first 200 tuples will have attribute A’s values in the range [0,99] and next 200 tuples will have attribute A’s values in the range [100,199] and so on .So number of tuples returned by the given selection query is 200.",,Databases,Data Models,Relational model
30,"A broadcast channel has 10 nodes and total capacity of 10 Mbps. It uses polling for medium access. Once a node finishes transmission, there is a polling delay of 80 μs to poll the next node. Whenever a node is polled, it is allowed to transmit a maximum of 1000 bytes. The maximum throughput of the broadcast channel is",,1 Mbps,,100/11 Mbps,,10 Mbps,,100 Mbps,,B,MCQ,Efficiency = transmission time/(transmission time + polling delay time) T t =1000 bytes/10Mbps =800μs. Polling delay is = 80 μs Efficiency=800/(800+80)= 10/11 Maximum throughput is =(10/11) * 10 Mbps= 100/11 Mbps,,Computer Networks,Data Link Layer,Medium Access Control
31,"Let us consider a statistical time division multiplexing of packets. The number of sources is 10. In a time unit, a source transmits a packet of 1000 bits. The number of sources sending data for the first 20 time units is 6, 9, 3, 7, 2, 2, 2, 3, 4, 6, 1, 10, 7, 5, 8, 3, 6, 2, 9, 5 respectively. The output capacity of multiplexer is 5000 bits per time unit. Then the average number of backlogged of packets per time unit during the given period is",,3,,4.26,,4.53,,5.26,,C,MCQ,"Average hops for a message to reach to root -  (3∗8)+(2∗4)+(1∗2)+(0∗1)15 = 2.267 Where, 3 hops & 8 routers for Bottom-most level and similarly the others Similarly average hops for a message to comes down to leaf- (3∗8)+(2∗4)+(1∗2)+(0∗1)15 So, Total Hops = 2 * 2.267 = 4.53",,Computer Networks,Switching,"Basics of packet, circuit and virtual circuit-switching"
32,"Let us consider a statistical time division multiplexing of packets. The number of sources is 10. In a time unit, a source transmits a packet of 1000 bits. The number of sources sending data for the first 20 time units is 6, 9, 3, 7, 2, 2, 2, 3, 4, 6, 1, 10, 7, 5, 8, 3, 6, 2, 9, 5 respectively. The output capacity of multiplexer is 5000 bits per time unit. Then the average number of backlogged of packets per time unit during the given period is",,5,,4.45,,3.45,,0,,B,MCQ,he capacity of multiplexer is 5000 bits per unit time. This means there are 5 packets per unit time since each source transmits a packet of 1000 bits in a unit time. If the number of packets transmitted is larger than 5 then the extra packets are backlogged. This number gets added to the next number and further backlog is calculated. Number of packets (+backlog from previous) Backlog 6 1 9+1 5 3+5 3 7+3 5 2+5 2 2+2 0 2 0 3 0 4 0 6 1 1+1 0 10 5 7+5 7 5+7 7 8+7 10 3+10 8 6+8 9 2+9 6 9+6 10 5+10 10 Total Backlog 89,,Computer Networks,Data Link Layer,Medium Access Control
33,Let A be the [Tex]\begin{bmatrix} 3 & 1\\ 1&2\end{bmatrix} [/Tex] . What is the maximum value of X T Ax where the maximum is taken over all x that are the unit eigenvectors of A?,,5,,(5 + √5)/2,,3,,(5 - √5)/2,,B,MCQ,"|M-λ.I| = 0, where λ is the eigen values and I is the identity matrix |A-(λ*I)| = 0 (3-λ)(2-λ)-1 = 0 6-3λ -2λ + λ 2 +1=0 λ 2 -5λ+5=0 λ = (5+√5)/2 and (5-√5)/2, λ = (5+√5)/2 is max value another root with negative sign which will not be max value. For, λ=5+5√2,  x T Ax=[18.131	21.231	21.231	34.331] For,  λ=5−5√2,  x T Ax= [Tex]\begin{bmatrix} 14.300&−0.700 \\ 6.200&1.200 \end{bmatrix}[/Tex] Hence, for λ=5+5√2 the value of x T Ax is maximum.",,Engineering Mathematics,Linear Algebra,Eigenvalues and eigenvectors
34,"In the waveform (a) given below, a bit stream is encoded by Manchester encoding scheme. The same bit stream is encoded in a different coding scheme in wave form (b). The bit stream and the coding scheme are",https://rkokdq5fgqqf84hb.public.blob.vercel-storage.com/gate-cs/2007/Question_Images/cbbd6388169325de-94HSQCbGbqwHXYwkfdK3hOHUK4gjOd.png,1000010111 and Differential Manchester respectively,,0111101000 and Differential Manchester respectively,,1000010111 and Integral Manchester respectively,,0111101000 and Integral Manchester respectively,,A,MCQ,"In simple language, Manchester encoding has +A to -A transition for the clock cycle for which bit is '1' and transition from -A to +A for the cycle when bit is '0' (A is the amplitude). The amplitudes are bipolar in Differential manchester encoding same as manchester encoding just that it toggles at '1'. When bit is '1' we get transition from +A to -A and it remains the same until next '1' arrives. The output changes to opposite transition (-A to +A) when next '1' arrives. The second encoding resembles the differential manchester code for the given number.","https://rkokdq5fgqqf84hb.public.blob.vercel-storage.com/gate-cs/2007/Explanation_Images/ef78a44d4da288ef-lSbNSxyLok5NZi3F2EFRu2IfdPcLXm.png, https://rkokdq5fgqqf84hb.public.blob.vercel-storage.com/gate-cs/2007/Explanation_Images/3857a103b619dd42-ULu8qMx7dnIMO1RJqipSdHl9skJDNd.png",Computer Networks,Data Link Layer,"Framing, error detection"
35,"For the network given in the figure below, the routing tables of the four nodes A, E, D and G are shown. Suppose that F has estimated its delay to its neighbors, A, E, D and G as 8, 10, 12 and 6 msecs respectively and updates its routing table using distance vector routing technique. A. B. C. D.","https://rkokdq5fgqqf84hb.public.blob.vercel-storage.com/gate-cs/2007/Question_Images/e832cb19351e563f-g7UObr3RUmaLbbkWzbXRBExY5XJjnV.jpg, https://rkokdq5fgqqf84hb.public.blob.vercel-storage.com/gate-cs/2007/Question_Images/e468771a5bf03dce-0hjkP4Ey40d0gx0SXLvxFbKgVpXsBU.jpg, https://rkokdq5fgqqf84hb.public.blob.vercel-storage.com/gate-cs/2007/Question_Images/a1209eb3415cbca6-1bTmfcsbJzYpWJJjcr9menYor21Yep.jpg, https://rkokdq5fgqqf84hb.public.blob.vercel-storage.com/gate-cs/2007/Question_Images/e0764e86269befa5-UvHVpCvWscjSufawNVz9hI9DM09Mvm.jpg, https://rkokdq5fgqqf84hb.public.blob.vercel-storage.com/gate-cs/2007/Question_Images/4161efad48e08cc8-2zloSf08UqFlWsBxwUqHlnZkGuinQf.jpg, https://rkokdq5fgqqf84hb.public.blob.vercel-storage.com/gate-cs/2007/Question_Images/24dd88d53ac53cd5-jduAz2VDmV83rtG5XW1pvOPAvgjQLX.jpg",A,,B,,C,,D,,A,MCQ,"Distance from F to F is 0 which option C is dropped Using DV routing protocol, F -> D -> B yields distance as 20 that drops option B and D.",,Computer Networks,Network Layer,Routing protocols
36,"The contents of the text file t1 txt containing four lines are as follows : a1        b1 a2        b2 a3        b2 a4        b1 The contents of the text file t2 txt containing five lines are as follows : a1        c1 a2        c2 a3        c3 a4        c3 a5        c4 Consider the following Bourne shell script : C awk - F ' ' ' { Print $1 , $2 } ' t1 . txt | while read a b ; do awk - v aV = $ a - v by = $b - F ' ' aV = = $1 ( print aV , bV , $2 ) ' t2 . txt done Which one of the following strings will NOT be present in the output generated when the above script in run? (Note that the given strings may be substrings of a printed line.)",,"""b1 c1""",,"""b2 c3""",,"""b1 c2""",,"""b1 c3""",,C,MCQ,,,Operating System,File Systems,
37,"A demand paging system takes 100 time units to service a page fault and 300 time units to replace a dirty page. Memory access time is 1 time unit. The probability of a page fault is p. In case of a page fault, the probability of page being dirty is also p. It is observed that the average access time is 3 time units. Then the value of p is",,0.194,,0.233,,0.514,,0.981,,A,MCQ,Page fault service time =100 page fault service time =300 (if there is dirty page) probability of page fault =p probability of being dirty is =p so total page fault service time(ps) = p(300)+ (1-p)(100) = 200p+100 now given EAT =3 so EAT = p(page fault service time +memory access time)+(1-p) memory access time 3= p*page fault service time + memory access time 3 =p(200p+100)+1= 200p 2 +100p+1 p=0.0194,,Operating System,Memory Management,Virtual Memory
38,Your are given the following four bytes :  10100011            00110111            11101001            10101011 Which of the following are substrings of the base 64 encoding of the above four bytes ?,,zdp,,fpq,,qwA,,oze,,B,MCQ,refer Base 64 table,,Computer Networks,Application Layer,
39,Consider the regular expression R = (a + b)* (aa + bb) (a + b)*<br> Which of the following non-deterministic finite automata recognizes the language defined by the regular expression R? Edges labeled λ denote transitions on the empty string.,https://rkokdq5fgqqf84hb.public.blob.vercel-storage.com/gate-cs/2007/Question_Images/c18c11496e787b5f-cXzpCFvzjaiDQZF0ITKlZ4cLsneE7r.jpg,A,,B,,C,,D,,A,MCQ,"baa is not accepted by B, so B eliminated<br>  in D a is accepted that’s not there in regular expression<br>  C accepts extra expressions",,Theory of Computation,Formal Languages and Automata,Regular expressions and finite automata
40,Consider the regular expression R = (a + b)* (aa + bb) (a + b)* Which deterministic finite automaton accepts the language represented by the regular expression R ?,https://rkokdq5fgqqf84hb.public.blob.vercel-storage.com/gate-cs/2007/Question_Images/45771de9e11e1914-7wc0EbbYpulLXTMbTiUPabU0kUYGaq.jpg,A,,B,,C,,D,,A,MCQ,The equivalent NFA is as follows: Table showing transitions between all states is as follows: The transition table can be converted to the transition table for DFA: Equivalent DFA for the above transition table is: Hence option (A) is the required DFA for the given regular expression.,"https://rkokdq5fgqqf84hb.public.blob.vercel-storage.com/gate-cs/2007/Explanation_Images/985974ceffb08638-myQAngZxxBG7CJpaNPqI2kFcu4QFdK.png, https://rkokdq5fgqqf84hb.public.blob.vercel-storage.com/gate-cs/2007/Explanation_Images/31c65f0f6a274eb0-3YouTm90I8A5gkBEmYLu2ZMGQQvtmT.png, https://rkokdq5fgqqf84hb.public.blob.vercel-storage.com/gate-cs/2007/Explanation_Images/23fe673b8b2fd04f-4f1WnAMo3EO9jwuKOdYt1aIxqkYDoh.png, https://rkokdq5fgqqf84hb.public.blob.vercel-storage.com/gate-cs/2007/Explanation_Images/39523be49985eb47-0pbkiLnqXLHJHhoi6FiDPaKivrhrXC.png",Theory of Computation,Formal Languages and Automata,Regular expressions and finite automata
41,Consider the regular expression R = (a + b)* (aa + bb) (a + b)*<br>  Which one of the regular expressions given below defines the same language as defined by the regular expression R?,,(a(ba)* + b(ab)*)(a + b) +,,(a(ba)* + b(ab)*)*(a + b)*,,(a(ba)* (a + bb) + b(ab)*(b + aa))(a + b)*,,(a(ba)* (a + bb) + b(ab)*(b + aa))(a + b) +,,C,MCQ,"The above DFA can be simplified by resolving the loop at states B and C and removing extra transitions at the final states which is as follows: To reach to a final state from B we can have alphabet ‘a’ to move to state D or ‘bb’ to move to state E. Similarly, to reach to a final state from C we can have alphabet ‘b’ to move to state E or ‘aa’ to move to state D.  Hence the regular expression is: (a(ba)*(a+bb) + b(ab)*(b+ aa))(a+b)* a(ba)*(a+bb): to move from A to B and B to any one of the final states b(ab)*(b+ aa): to move from A to C and C to any one of the final states Note: We can also use Option Elimination method for such questions i.e. we can reject an option if we  find at least such string that does not validate the regular expression. Option (A) accepts ab but given regular expression does not. Option (B) accepts an empty string but given regular expression does not. Option (D) does not accept aa but the given regular expression does.","https://rkokdq5fgqqf84hb.public.blob.vercel-storage.com/gate-cs/2007/Explanation_Images/142229483c0bd57c-8FU3mvwd4Adm2DbHM2Ftoe47ZHz2jx.png, https://rkokdq5fgqqf84hb.public.blob.vercel-storage.com/gate-cs/2007/Explanation_Images/6baf026302062029-qRtDrhdVzXp11d6JaWwdqxdoNU94XO.png",Theory of Computation,Formal Languages and Automata,Regular expressions and finite automata
42,"Consider a token ring topology with N stations (numbered 1 to N) running token ring protocol where the stations are equally spaced. When a station gets the token it is allowed to send one frame of fixed size. Ring latency is t p , while the transmission time of a frame is t t . All other latencies can be neglected. The maximum utilization of the token ring when t t =3 ms, t p = 5 ms, N = 10 is",,0.545,,0.6,,0.857,,0.961,,C,MCQ,"Maximum efficiency of token ring = (t t )/(t t +( t p /n)) t t = 3 ms t p =5 ms and n=10, efficiency = 3/(3+.5)= .857",,Computer Networks,Data Link Layer,Medium Access Control
43,"Consider a token ring topology with N stations (numbered 1 to N) running token ring protocol where the stations are equally spaced. When a station gets the token it is allowed to send one frame of fixed size. Ring latency is t p , while the transmission time of a frame is t t . All other latencies can be neglected. The maximum utilization of the token ring when t t = 5 ms, t p = 3 ms, N = 15 is :",,0.545,,0.655,,0.9375,,0.961,,D,MCQ,"Maximum efficiency of token ring = (t t )/(t t +( t p /n)) t t = 5 ms t t =3 ms and n=15, efficiency = (5)/(5+3/15) = 5/5.2 = .961",,Computer Networks,Data Link Layer,Medium Access Control
44,"Consider the sequence <x n >, n>= 0 defined by the recurrence relation x n + 1 = c . x n 2 - 2, where c > 0. Suppose there exists a non-empty, open interval (a, b) such that for all x 0 satisfying a < x 0 < b, the sequence converges to a limit. The sequence converges to the value?",,(1 + (1 + 8c) 1/2 )/2c,,(1 - (1 + 8c) 1/2 )/2c,,2,,2/(2c-1),,B,MCQ,,https://rkokdq5fgqqf84hb.public.blob.vercel-storage.com/gate-cs/2007/Explanation_Images/0bafbeeca0bdec1a-yRhOjmrxniAsdLsADHXOQXPkmpk1Gu.png,Engineering Mathematics,Calculus,"Limits, continuity and differentiability"
45,Consider the following expression ad' + (ac)' + bc'd Which of the following Karnaugh Maps correctly represents the expression?,"https://rkokdq5fgqqf84hb.public.blob.vercel-storage.com/gate-cs/2007/Question_Images/e93d4bf74f1ecbca-y1JV1uaS0WRW8u1PSfXaOZIrvoDj4R.jpg, https://rkokdq5fgqqf84hb.public.blob.vercel-storage.com/gate-cs/2007/Question_Images/fa659caedc3e6c20-pWwMryqRCnk8tuNdtzODWr5BNYSC8b.jpg, https://rkokdq5fgqqf84hb.public.blob.vercel-storage.com/gate-cs/2007/Question_Images/a6df31e6d4edbcbc-6OjoYRBiNmbGz7msWR0lOTVgYfrAXj.jpg, https://rkokdq5fgqqf84hb.public.blob.vercel-storage.com/gate-cs/2007/Question_Images/359de2f5fe180495-ZkdAnU3nwMG5YA37XUpC3Pcd80C1B1.jpg",A,,B,,C,,D,,C,MCQ,,,Digital Logic,Minimization,
46,Consider the following expression ad' + (ac)' + bc'd Which of the following expressions does not correspond to the Karnaugh Map obtained for the above expression??,,c'd'+ ad' + abc' + (ac)'d,,(ac)' + c'd' + ad' + abc'd,,(ac)' + ad' + abc' + c'd,,b'c'd' + acd' + (ac)' + abc',,A,MCQ,,,Digital Logic,Minimization,
47,"Let P 1 , P 2 ,..... , P n be n points in the xy-plane such that no three of them are collinear. For every pair of points P i and P j , let L ij be the line passing through them. Let Lab be the line with the steepest gradient amongst all n(n -1)/2 lines. Which one of the following properties should necessarily be satisfied ?",,P a and P b are adjacent to each other with respect to their x-coordinate,,Either P a or P b has the largest or the smallest y-coordinate among all the points,,The difference between x-coordinatef P a and P b is minimum,,None of the above,,D,MCQ,,https://rkokdq5fgqqf84hb.public.blob.vercel-storage.com/gate-cs/2007/Explanation_Images/91bb06e29bc02d1f-4fOVNI1EiBLtrTgiIb8L18Gj4A2EnI.png,Algorithms,Basic Techniques,"Searching, sorting, hashing"
